id,title,author,text,label
710,СМИ: в России создадут систему для отслеживания приближающихся со стороны Солнца тел,RT на русском,"Короткая ссылка  25 Совет РАН по космосу утвердил параметры проекта «Система обнаружения дневных астероидов» (СОДА), целью которого является мониторинг космических тел, приближающихся к Земле со стороны Солнца. 
Бюджет, выделенный на научно-исследовательские работы по проекту СОДА составит 10 млн рублей, пишет газета «Известия. На научно-исследовательскую работу «СОДА-обнаружение»— математическое моделирование работы СОДА — будет выделено 2,5 млн рублей. Головным исполнителем назначен Институт астрономии РАН (ИНАСАН). 
По данным издания, проект СОДА предусматривает строительство космического аппарата, который планирую отправить в одну из точек Лагранжа на расстоянии 1,5 миллиона километров от Земли. Телескоп, размещённый в аппарате, будет предупреждать о телах, которые направляются к Земле со стороны Солнца. 
По словам научного руководителя ИНАСАН Бориса Шустова, необходимость в подобной системе стала ощущаться после падения метеорита «Челябинск» в 2013 году, которое показало, «что никакими наземными средствами невозможно обнаружить космическое тело, приближающееся к нам со стороны Солнца». 
Ранее жители Бурятии и Иркутской области стали свидетелями падения болида.  ",1
711,5 Things You Need to Know About the Blacked Out Dakota Access Pipeline Protests,The Anti-Media,"
by Nick Bernabe
A small Standing Rock Sioux site in North Dakota called the Sacred Stone Camp has been propelled into the national news narrative following their stand against the Dakota Access Pipeline. Due in part to independent media coverage of the ongoing standoff, the Sacred Stone camp has grown into a formidable opposition against the $3.8 billion, 1,200-mile long pipeline.
Due to misinformation coming from law-enforcement, political favoritism toward the pipeline builders, and the media’s blatant reluctance to report on the pipeline, it’s hard to tell truth from fiction. Anti-Media , along with our partners in the independent media and our embedded journalist at the opposition encampment, have been covering the unfolding standoff continuously. Here are five things you need to know.
1. Who is opposing the pipeline — and why 
The Standing Rock Sioux tribe is leading the opposition to the Dakota Access Pipeline. They have been joined by the largest tribal coalition in over 100 years in their stand against the pipeline. The coalition is also comprised of activists, allies, and environmentalists, collectively known as “water protectors,” at the Sacred Stone Camp, an encampment close to the location where the pipeline is planned to cross the Missouri River in North Dakota. According to the Sacred Stone camp website , they are opposing the pipeline because “[t]he Dakota Access threatens everything from farming and drinking water to entire ecosystems, wildlife and food sources surrounding the Missouri.” 
The Standing Rock Sioux also say the pipeline is violating treaty land , Sioux territory that was established many years ago by the federal government. “We will not allow Dakota Access to trespass on our treaty territory and destroy our medicines and our culture.” 
The opposition to the pipeline spreads across several states and is not opposed solely by Native Americans. Farmers, ranchers, and landowners are also opposed to the pipeline. Many of them have had their land taken from them against their will and given to the pipeline via eminent domain.
2. The U.S. government and the pipeline corporation are continuing a long tradition of disrespecting Native Americans 
The United States has a very bad reputation for treating Native Americans, the original inhabitants of this land, as less than human. In many instances in the past, the land where Native Americans lived was deemed to be of higher value than the Natives’ lives.
Such has been the case in North Dakota — not only now, but in the past as well. According to The Atlantic :
“The land beneath the pipeline was accorded to Sioux peoples by the Treaty of Fort Laramie in 1868. Eleven years later, the U.S. government incited and won the Great Sioux War, and ‘renegotiated’ a new treaty with the Sioux under threat of starvation. In that document, the tribe ceded much of the Laramie land, including the Black Hills of South Dakota, where many whites believed there to be gold.”
After the federal government relegated the Sioux people to the “Great Sioux Reservation” in 1851 , the treaty was re-written and “renegotiated” by force whenever resources were discovered or when the U.S. government wanted land. Essentially, the Sioux people were victims of U.S.-sanctioned murder, and their land was stolen because gold was discovered on it.
Fast forward to 2016 and the Sioux people are once again making a stand on land that was once — and still is , according to the tribe — theirs. How is the government reacting to this stand? By brutally arresting the Native American water protectors for trespassing . If that is not a miscarriage of justice, I don’t know what is.
Further, Energy Transfer Partners, the company pulling the strings behind the DAPL, has deep pockets, and its lobbyists have cozied up to federal, state, and local governments with jurisdiction over the pipeline route. This could explain why the company began its construction of the pipeline on Army Corps of Engineers land without even securing an easement , which is required by law. Dakota Access LLC, a subsidiary of Energy Transfer Partners, has also used the strong-arm of government to force farmers and landowners to hand over their land to the pipeline against their will.
3. Violent acts are being carried out in North Dakota, but not by the water protectors 

Violence is breaking out at the Dakota Access Protest site, but the protesters have nothing to do with it. Pipeline police, bolstered by the North Dakota National Guard and sheriffs imported from around the country, have turned the standoff into a war zone. Water protectors are regularly pepper sprayed, tear gassed, and violently arrested. Over the weekend, 127 people were detained in the biggest mass arrest to date.
Militarized police at the Dakota Access Pipeline site are decked out in riot gear, armed with military grade weapons, use armored cars or MRAPs with snipers on top of them, and have regularly used LRADs, a type of mass crowd dispersal weapon that uses a high pitched noise to hurt people’s ears — sometimes permanently .
Early reports of protesters being armed and violent have proven to be instances of misinformation spread by law enforcement apparently seeking to demonize the opposition. No credible reports of violence by the protesters have been confirmed or prosecuted. Nearly all arrests stem from trespassing charges or crimes of journalism.
When protesters initially began using civil disobedience to physically shut down the Dakota Access Pipeline site, they were confronted violently by security guards from British mercenary firm G4S. The mercs sicced dogs and used pepper spray on the protesters in an assault that went viral and helped catalyze even more support for the water protectors.
4. Independent media is under attack at the Dakota Access Pipeline — and the corporate media is ignoring it 
Independent media’s broadcasts over the Internet are basically the only reason people around the country and the world now know about the struggle at Standing Rock. Unfortunately, journalists are not immune to the police crackdowns in North Dakota. Dozens of journalists have now been arrested, and an arrest warrant was issued for high-profile journalist Amy Goodman. One independent media outlet, Unicorn Riot , saw four of their journalists arrested in one day in North Dakota. One filmmaker is facing up to 45 years in prison for filming acts of civil disobedience against the pipeline.
Anti-Media ’s journalist on the ground, Derrick Broze, was tased by law enforcement while covering the protests on Thursday as this article was being written.
Meanwhile, the national corporate media ignored the battle against the Dakota Access Pipeline as long as they could. For months, despite the DAPL emergence into the national narrative, ABC and NBC refused to air any coverage about it. A woman was arrested for protesting the pipeline on her own farm after Dakota Access LLC gained access to it against her will via eminent domain — yet there was still no corporate media coverage on the incident.
5. How you can help the opposition 

Now that you see what water protectors are up against in North Dakota, here’s what you can do to help.
Get yourself to the Sacred Stone Camp. The water protectors need reinforcements as people are regularly arrested. The bigger the stand, the more likely the pipeline’s construction will be halted. Here’s how to get there . Send supplies or donations. Water protectors need your help with supplies and funding. Go to this link to send supplies. Go to this link to donate to the cause. Support independent journalists that risk arrest to bring you the news from the front lines. Follow Sacred Stone Camp on Facebook. Share this article. For 10 more ways to get involved, click here . Delivered by The Daily Sheeple 
We encourage you to share and republish our reports, analyses, breaking news and videos ( Click for details ). 
Contributed by The Anti-Media of theantimedia.org . 
The “Anti” in our name does not mean we are against the media, we are simply against the current mainstream paradigm. The current media, influenced by the industrial complex, is a top-down authoritarian system of distribution—the opposite of what Anti-Media aims to be. At Anti-Media, we want to offer a new paradigm—a bottom-up approach for real and diverse reporting. We seek to establish a space where the people are the journalists and a venue where independent journalism moves forward on a larger and more truthful scale. ",1
712,Germany: Iraqi Asylum-Seeker Convicted of Raping Chinese Students,Breitbart London,"BERLIN (AP)  —   A German court has convicted a    Iraqi man of raping two Chinese college students in the western city of Bochum. [The dpa news agency reported Tuesday that the court sentenced the man to 11 years in prison.  The defendant, who wasn’t identified by name, acknowledged in court that he assaulted the women in August and November last year. DNA evidence linked him to both crimes. The defendant came to Germany as an   more than a year ago with his wife and children. The victims, who were 21 and 27 years old at the time, had been studying at Bochum university. The   case was one of several that fanned a national debate in Germany about how to respond to a rise in violent crimes committed by migrants.",0
713,Teenage Boy KNOCKS OUT His Classmate For Assaulting Their Female Teacher In The FACE- And It’s EPIC!,shelby andrews,"0 comments 
Not a lot of teenage boys would go out of their selfish ways to stand up for a teacher like this. He stood up for his teacher when his peer punched her in the face. This young man is certainly respectable! 
A shocking video has emerged showing the moment a protective student knocked out a classmate who had just attacked their female teacher. The footage shows that the teacher was trying to break up a fight between two students – one in a red hoodie and one in a black hoodie – when the boy in the red turns around and hits her in the face. The teacher, dressed in white and wearing glasses, appears to fall to the ground after being hit, and then leaves the classroom. 
Then, a third student comes in and punches the boy in head, sending him straight down to the ground. The third student is heard saying: ‘Watch the f— out, you just hit the fucking teacher.’ He then adds: ‘Chill your s—, you just hit the f—ing teacher, you don’t f—ing do that. Who the f— do you think you are?’ 
The teacher then reappears in the room, and appears relatively unscathed. She tells the group to stop fighting and separate.‘He just f—ing hit you, that’s not cool,’ says the boy that came to her defense.‘It’s not cool,’ the teacher replies. It is unclear where the video was filmed or what school was involved, however the clip was spreading quickly on social media on Wednesday after appearing on the website LiveLeak. Some viewers questioned whether the boy in red may have mistakenly hit the teacher, believing she were the other one of the students. However others said he clearly meant to hit the woman. 
Shout out to the boy for standing up for what is right! Related Items",1
714,What Does it Take to Bring Hillary Clinton to Justice?,Pepe Escobar," What Does it Take to Bring Hillary Clinton to Justice?
By Pepe Escobar
 RT "" - Virtually the whole planet holds its collective breath at the prospect of Hillary Clinton possibly becoming the next President of the United States (POTUS).
Hows that humanly possible, as the (daily) Bonfire of The Scandals  relentlessly fed by WikiLeaks revelations and now converging FBI investigations - can now be seen from interstellar space? Its possible because Hillary Clinton, slouching through a paroxysm of manufactured hysteria, is supported by virtually the whole US establishment, a consensual neocon/neoliberalcon War Party/Wall Street/corporate media axis.
But History has a tendency to show us theres always a straw that breaks the camels back.
This could be it  as revealed by WikiLeaks ; March 2, 2015, the day when John Podesta wrote, we are going to have to dump all those emails.
That happened to be the exact same day it was revealed Hillary Clinton had used a personal email server as Secretary of State.
Yet this reveals only part of the puzzle. Theres got to be a response to Podestas email  which WikiLeaks may, or may not, leak in the next few days before the election. If the back and forth clearly shows intent (to mislead), then weve got a 100 percent smoking gun: the whole Clinton (cash) machine narrative  according to which Hillary just deleted ""personal"" emails  crumbles like the ultimate House of Cards.
Moreover, that would unveil what was from the start the privileged Clinton machine strategy: to thwart the subsequent internal State Dept. and FBI investigations.
As far as the Clinton machine is concerned, an interlocking influence peddling pile up is the norm. John Podesta also happens to be the founder of the Center for American Progress  a George Soros operation and prime recruiting ground for Obama administration officials, including US Treasury operatives who decided which elite Too Big To Fail (TBTF) financial giants would be spared after the 2008 crisis. DCLeaks.com , for its part, has connected Soros Open Society foundations to global funding rackets directly leading to subversion of governments and outright regime change (obviously sparing Clinton Foundation donors.)
Exceptional bananas, anyone? The perfectly timed slow drip of WikiLeaks revelations, for the Clinton machine, feels like a sophisticated form of Chinese torture. To alleviate the pain, the relentless standard spin has been to change the subject, blame the messenger, and attribute it all to evil Russian hacking when the real source for the leaks might have come straight from the belly of the (Washington) beast.
At the Valdai discussion club last week, it took President Putin only a few sentences to debunk the whole Clinton machine narrative with a bang:
Another mythical and imaginary problem is what I can only call the hysteria the USA has whipped up over supposed Russian meddling in the American presidential election. The United States has plenty of genuinely urgent problems, it would seem, from the colossal public debt to the increase in firearms violence and cases of arbitrary action by the police.You would think that the election debates would concentrate on these and other unresolved problems, but the elite has nothing with which to reassure society, it seems, and therefore attempt to distract public attention by pointing instead to supposed Russian hackers, spies, agents of influence and so forth.
I have to ask myself and ask you too: Does anyone seriously imagine that Russia can somehow influence the American peoples choice? America is not some kind of banana republic, after all, but is a great power. Do correct me if I am wrong.
Reality, though, continues to insist on offering multiple, overlapping banana republic instances, configuring a giant black hole of transparency.
Anthropologist Janine Wedel has been one of the few in Clinton-linked US mainstream media acknowledging how Bill Clinton, while Hillary was Secretary of State, perfected his version of philantro-capitalism (actually a money laundering pay to play racket), a practice by no means confined to the Clintons.
And the racket prospered with inbuilt nuggets, such as Hillary being perfectly aware that prime Clinton Foundation donors Qatar and Saudi Arabia were also financing ISIS/ISIL/Daesh.
Huma, the Fall Princess Now, less than a week before the election, we have come to the crucial juncture where the WikiLeaks revelations are merging with the FBI investigations - all three of them.
Exhibit A is this WikiLeaks bombshell ; Peter Kadzik, whos now in charge of the Department of Justice (DOJ) probe into the 650,000 emails found on the laptop shared by Clintons right-hand woman Huma Abedin and her estranged, pervert husband Anthony Wiener, is a Clinton asset.
Not only Kadzik was an attorney for Marc Rich when he was pardoned by Bill Clinton; Podesta  as also revealed by WikiLeaks - thanked Kadzik for keeping him out of jail ; and it was Kadzik who gave Podesta a secret heads up on the Clinton email investigation.
The Clinton machine, starring a self-described virtuous Madonna, is actually a pretty nasty business. Huma and her familys close connections to Saudi Arabia  and the Muslim Brotherhood  are legendary (that includes her brother Hassan, who works for Sheikh Yusuf al-Qaradawi). Podesta, by the way, is a handsomely remunerated lobbyist for Saudi Arabia in Washington; thats part of the Clinton Foundation connection.
Yet now, with Huma in the spotlight  still maintaining she didnt know all those emails were in her and Wieners laptop - its no wonder Hillary has instantly downgraded her, publicly, to one of my aides . She used to be Hillarys ersatz daughter ; now shes being framed as The Fall Princess.
And that brings us to the intersection of those three FBI investigations; on Hillarys Subterranean Email Server (in theory closed by FBIs Comey last summer); on the Clinton Foundation; and on Wieners sexting of minors. The FBI has been investigating the Clinton Foundation for over a year now. Lets try to cut a long story short.
Follow the evidence Last July, the DOJ  under Clinton/Obama asset Loretta Lynch - decided not to prosecute anyone on Emailgate. And yet FBI director Comey  who nonetheless stressed Hillarys extreme carelessness  turbo-charged his no-denial mode on another investigation, as in the FBI sought to refocus the Clinton Foundation probe.
Soon we had Clinton Foundation FBI investigators trying to get access to all the emails turned over in the Emailgate investigation. The East District of New York refused it. Very important point; up to 2015, guess who was the US attorney at the East District; Clinton/Obama asset Lynch.
Enter an extra layer of legalese. Less than two months ago, the Clinton Foundation FBI investigators discovered they could not have access to any Emailgate material that was connected to immunity agreements.
But then, roughly a month ago, another FBI team captured the by now famous laptop shared by Huma and Wiener - using a warrant allowing only a probe on Weiners sexting of a 15-year-old girl. Subsequently they found Huma Abedin emails at all her accounts  from Humaabedin@yahoo.com to the crucial huma@clintonemail.com . This meant not only that Huma was forwarding State Dept. emails to her private accounts, but also that Hillary was sending emails from the secret clintonemail.com to Huma at yahoo.com.
No one knew for sure, but some of these emails might be duplicates of those the Clinton Foundation FBI investigators could not access because of the pesky immunity agreements.
Whats established by now is that the metadata in the Huma/Wiener laptop was duly examined. Now picture both teams of FBI investigators  Clinton Foundation and pervert Wiener  comparing notes. And then they decide Humas emails are relevant.
Key questions apply; and the most pressing is how the emails were deemed relevant if the investigators could only examine the metadata. What matters is that Comey certainly was made aware of the content of the emails  a potential game-changer. Thats why one of my sources insists his decision to go public came from above.
The other key question now is whether the DOJ  via Kadzik? - will once again thwart another investigation, this time on the Clinton Foundation. Senior, serious FBI agents wont take that  massive euphemism  kindly.
The FBI has been on the Clinton Foundation for over a year. Now, arguably, they are loaded with evidence  and they wont quit. Winning the presidency now seems to be the least of Hillary Clintons Bonfire of Scandals problems.
Pepe Escobar is an independent geopolitical analyst. He writes for RT, Sputnik and TomDispatch, and is a frequent contributor to websites and radio and TV shows ranging from the US to East Asia. He is the former roving correspondent for Asia Times Online. Born in Brazil, he's been a foreign correspondent since 1985, and has lived in London, Paris, Milan, Los Angeles, Washington, Bangkok and Hong Kong.",1
