id,title,author,text,label
446,"After Obama Cancels Talk, Rodrigo Duterte of Philippines Says He Regrets Slur - The New York Times",Christine Hauser,"President Obama canceled a meeting with President Rodrigo Duterte of the Philippines scheduled for Tuesday in Laos, after the Philippine president directed an expletive at Mr. Obama on Monday. On Tuesday, Mr. Duterte released a statement saying he regretted that his curse “came across as a personal attack on the U. S. president. ” He blamed his words on “certain press questions that elicited concern and distress. ” Mr. Duterte had warned Mr. Obama not to ask him about extrajudicial killings related to his crackdown on drug dealers, a campaign pledge that helped sweep him to victory in the country’s presidential election in May. “I am a president of a sovereign state, and we have long ceased to be a colony,” Mr. Duterte told reporters before he left his country for Laos, where he and Mr. Obama will attend the meeting of the Association of Southeast Asian Nations. “I do not have any master except the Filipino people, nobody but nobody,” he said in remarks published by The Associated Press. Apparently addressing Mr. Obama, he added: “You must be respectful. Do not just throw questions. ” Then, using a curse in Tagalog that can be translated as “son of a bitch,” he added, “I will swear at you in that forum. ” Mr. Obama, who was in China for a Group of 20 meeting, departed on Monday for Laos, becoming the first American president to visit the nation. He is also scheduled to take part in the East Asia Summit and speak at a forum with young people. Mr. Obama had planned to meet Mr. Duterte in Laos, but the White House said early Tuesday that the meeting had been canceled. “Clearly, he’s a colorful guy,” Mr. Obama said Monday. “I always want to make sure if I’m having a meeting that it’s productive. ” Mr. Duterte acknowledged Tuesday that the meeting had been canceled and seemed to take a softer tone: “We look forward to ironing out differences arising out of national priorities and perceptions, and working in mutually responsible ways for both countries. ” Last month, the Philippines’ top police official, Chief Ronald dela Rosa, told a Senate hearing that killings by the police and vigilantes in the country’s war on drugs had soared to nearly 1, 800 in the seven weeks since Mr. Duterte, a former mayor of Davao, was sworn into office. Mr. Duterte’s public image has been characterized by bouts of coarse language. He has lashed out at his critics, threatening to withdraw from the United Nations after human rights experts called for a halt to the killings. He joked about the rape of an Australian missionary during the presidential campaign, and he cursed Pope Francis and his entourage for causing huge traffic jams in Manila during the pope’s visit to the Philippines in 2015.",0
447,"New Jersey Will Increase Gas Tax 23¢, Ending Long Political Stalemate - The New York Times",Patrick McGeehan,"Gov. Chris Christie, who has long resisted raising any taxes, has battled with Democratic leaders since early summer over raising New Jersey’s gas tax, reaching an impasse that brought hundreds of highway and transit projects to a standstill that lasted months. But on Friday, a day after a fatal train crash in Hoboken focused attention on the troubled conditions of the   railroad, Mr. Christie, a Republican, finally gave way by accepting the first tax increase during his seven years in office. He said he had agreed to raise the gas tax by 23 cents a gallon to replenish the depleted Transportation Trust Fund, which the state uses to pay for improvements to rails, roads and bridges. Mr. Christie, who has just over one year left in his second term, has prided himself on his refusal to raise taxes and promoted his record during his campaign to be the Republican presidential candidate. But he said he made an exception for the gas tax because the need to maintain the state’s transportation infrastructure was so critical. “While I’m not authorizing any other tax increase during my time as governor,” he said, “I’m authorizing this one because of the importance of the Transportation Trust Fund, the tax fairness that we’ve accomplished together and the compromise we’ve reached, and because we need to responsibly finance this type of activity. ” Mr. Christie made the announcement at the State House in Trenton, flanked by the State Senate president, Stephen M. Sweeney, and the speaker of the State Assembly, Vincent Prieto, both Democrats. The three men each described the agreement as a   compromise. “Sorry it took so long,” Senator Sweeney said. “But we all have strong personalities, and sometimes it just takes time to get together. ” The increase could take effect as soon as next week. The Legislature has scheduled a special session for Wednesday to vote on the matter. In exchange for Mr. Christie’s acceptance of the higher gas tax, the Democrats agreed to lower the state’s sales tax by less than half a penny and to phase out the estate tax by 2018. Mr. Christie said the sales tax rate would decrease next year to 6. 875 percent, from 7 percent. In 2018, he said, it will drop again, to 6. 625 percent. He said the gas tax would pay for an   $32 billion reauthorization of the Transportation Trust Fund, adding that “$32 billion will be invested in infrastructure and improvements and modernizations in the state of New Jersey over the next eight years. ” Mr. Prieto said that the agreement “couldn’t come soon enough,” and that replenishing the transportation fund was “so important because it’s a public safety issue. ” Mr. Christie had argued for the reduction of other taxes to balance the tax burden of New Jersey residents. He had called for a 1 cent decrease in the sales tax rate, but settled for a package of cuts that would include the smaller decrease. Along with the   drop in the sales tax, the Democrats also accepted a phaseout of the state’s estate tax, an increase in the   tax credit for the working poor and a tax break for veterans. The     increase in what the state collects on fuel sales  —   currently the   rate of all the states  —   would be the first in New Jersey in nearly three decades. It was last raised in 1988, and now only Alaska’s is lower. With the proposed increase, to 37. 5 cents, New Jersey’s gas tax would be considerably higher than the national average of about 21 cents. The agreement met with immediate criticism from some advocacy groups. “These leaders have foolishly paired a big package of tax cuts that will disproportionately benefit   New Jerseyans while decimating the state’s ability to pay for essential services, promised obligations and other critical investments,” said Jon Whiten, the vice president of New Jersey Policy Perspectives. “While it is absolutely essential that New Jersey invest in its transportation infrastructure, that investment should not be held hostage to some warped idea of   tax fairness that will cost the state well over $1 billion a year,” Mr. Whiten added. “This is, quite simply, the wrong path forward for New Jersey. ” Mr. Christie said the trust fund would receive $2 billion a year for eight years, which he said would be its biggest and longest reauthorization. With federal matching funds, he said, the state would have $32 billion to spend on road and transit projects over the next eight years. The governor said the tax cuts were estimated to save the state’s taxpayers $164 million next year and as much as $1. 4 billion when they are completely in place in 2021.",0
448,ABC: Manchester Attack ’Likely to Inflame Anti-Islamic Sentiment’ - Breitbart,Ian Hanchett,"On Tuesday’s “Good Morning America,”   George Stephanopoulos and ABC Chief Global Affairs Correspondent Martha Raddatz stated that the attack in Manchester could lead to   backlash.  Stephanapolous said that while people are determined to go back to their normal lives, “this is also likely to inflame   sentiment across Britain, across Europe. ” Raddatz responded, “It sure could, George. You know, Manchester itself is a very multicultural city. There’s a large Muslim population, with many there for generations. So, a headscarf attracts little attention there. And notably, Manchester did not vote in favor of Brexit, but an attack like this, as you said, is much bigger than Manchester itself, and will likely create backlash depending, of course, on the details of this attack, George. ” (  WFB) Follow Ian Hanchett on Twitter @IanHanchett",0
449,Hidden in plain sight – The global depopulation agenda,Nathanial Mauka,"October 26, 2016 “Maintain humanity under 500,000,000 in perpetual balance with nature.” ~ Georgia Guidestones 
This is one of the first of ten commandments blazoned across the Georgia Guidestones, an occult monument for which no person or organization has taken credit. Though the monument was commissioned by someone named R.C. Christian more than two decades ago, the true identity of the person who built this specter is still unidentified, and the message is but one of the many examples of a cabalistic desire to cull the population. 
There are many more ‘hidden’ in plain sight. 
The Georgie Guidestones state : 1. Maintain humanity under 500,000,000 in perpetual balance with nature. 2. Guide reproduction wisely – improving fitness and diversity. 3. Unite humanity with a living new language. 4. Rule passion – faith – tradition – and all things with tempered reason. 5. Protect people and nations with fair laws and just courts. 6. Let all nations rule internally resolving external disputes in a world court. 7. Avoid petty laws and useless officials. 8. Balance personal rights with social duties. 9. Prize truth – beauty – love – seeking harmony with the infinite. 10.Be not a cancer on the earth – Leave room for nature – Leave room for nature. 
Though some of these commandments seem harmless enough, the very first describes the supreme sentiment of the mysterious group of masons who erected the stones. If you want further narrative for what they bode, you don’t have to look far. As Stanford University Professor, Paul Ehrlich , the author of The Population Bomb states , “The first task is population control at home. How do we go about it? Many of my colleagues feel that some sort of compulsory birth regulation would be necessary to achieve such control. One plan often mentioned involves the addition of temporary sterilants to water supplies or staple food. Doses of the antidote would be carefully rationed by the government to produce the desired population size.” 
We can see clearly that the ‘elite’ class, intent on ridding the planet of its burdensome load, has already poisoned the water of 42 out of 50 states with lead . Pesticides and fertilizers poison the remaining states’ water along with the original 42 states. Male infertility is rising due to these contaminants, and premature births along with miscarriage are more common due to others. If the water doesn’t kill you, it will simply lobotomize you, or at least start the process. Harvard medical has pronounced that fluoridated water lowered IQ scores in children who drank it, and aluminum along with fluoride is a known neurotoxin, also contributing to the rising numbers of Alzheimer’s, Parkinsons, and similar neurodegenerative diseases. READ: 11 Common Symptoms of the Global Depopulation Slow Kill 
Should poisoning the water be insufficient to keep the population down, we can look to the advice of David Brower, once Executive Director of the Sierra Club and founder of the Friends of the Earth. He suggests that, “Childbearing [should be] a punishable crime against society, unless the parents hold a government license … All potential parents [should be] required to use contraceptive chemicals, the government issuing antidotes to citizens chosen for childbearing.” 
Forced and coerced sterilization at the hands of the Eugenics Board and other bodies is nothing new. Some investigators recently found that 148 female inmates in two California prisons were sterilized between 2006 to 2010 — and there may be 100 more incidents dating back to the late 1990s. One reporter wrote , “ The women were signed up for the surgery while they were pregnant and housed at either the California Institution for Women in Corona or Valley State Prison for Women in Chowchilla, which is now a men’s prison. 
Former inmates and prisoner advocates maintain that prison medical staff coerced the women, targeting those deemed likely to return to prison in the future. 
Crystal Nguyen, a former Valley State Prison inmate who worked in the prison’s infirmary during 2007, said she often overheard medical staff asking inmates who had served multiple prison terms to agree to be sterilized. 
“I was like, ‘Oh my God, that’s not right,’” Nguyen, 28, said. “ Do they think they’re animals, and they don’t want them to breed anymore? ” 
Today vaccines are used in a similar manner to help cull the population against their informed consent. Eugenicist, Bill Gates tried to ‘ field test ’ his HPV vaccine in India on indigenous young girls, but the Indian government eventually brought a stop to this. The Rockefeller family also quietly funds vaccines that alter a woman’s hormones to make her less likely to become pregnant or to maintain a pregnancy. A book titled Disciplining Reproduction by Adele E. Clark explains what the elites were planning as early as the 1930s. “ Other lines of current immunological contraceptive research continue to seek what, during the 1930s, Max Mason of the Rockefeller Foundation called “anti-hormones”: vaccines to block hormones needed for very early pregnancy and a vaccine to block the hormone needed for the surface of the egg to function properly .” 
Barack Obama’s top science advisor , John P. Holdren has also said : “ A program of sterilizing women after their second or third child, despite the relatively greater difficulty of the operation than vasectomy, might be easier to implement than trying to sterilize men . The development of a long-term sterilizing capsule that could be implanted under the skin and removed when pregnancy is desired opens additional possibilities for coercive fertility control. The capsule could be implanted at puberty and might be removable, with official permission, for a limited number of births.” 
A simple look at the peer-reviewed Plos One site offers over 7,500 additional scientific articles that connect vaccines to sterilization. 
Should vaccines or forced implants be insufficient to reduce the number of ‘useless eaters’ in the world, as Henry Kissinger has implied, then there is also the revealing text of Dr. John Colemann, who outlines the aims of a Committee of 300, otherwise known as the original hierarchical organization to plan a New World Order . Among their plans are genocide, war, the installation of dictators, the legalization of drug use, and the normalizing of pornography : “To bring about depopulation of large cities according to the trial run carried out by the Pol Pot regime in Cambodia. It is interesting to note that Pol Pot’s genocidal plans were drawn up in the US by one of the Club of Rome’s research foundations, and overseen by Thomas Enders, a high-ranking State Department official. It is also interesting that the committee is currently seeking to reinstate the Pol Pot butchers in Cambodia. “….To cause by means of limited wars in the advanced countries, by means of starvation and diseases in the Third World countries, the death of three billion people by the year 2050, people they call ‘useless eaters.’ The Committee of 300 (Illuminati) commissioned Cyrus Vance to write a paper on this subject of how to bring about such genocide. The paper was produced under the title “Global 2000 Report” and was accepted and approved for action by former President James Earl Carter, and Edwin Muskie, then Secretary of State, for and on behalf of the US Government. Under the terms of the Global 2000 Report, the population of the US is to be reduced by 100 million by the year of 2050. “……To encourage, and eventually legalize the use of drugs and make pornography an ‘art-form,’ which will be widely accepted and, eventually, become quite commonplace.” 
Look no further than Syria , Iraq, Afghanistan, Turkey, and a myriad other examples of false flag terrorism . Look no further than the top twenty pharmaceutical companies (all U.S., Illuminati based ) that control almost 99 percent of the world’s massive, ‘legalized’ drug trade. See clearly, the genocide happening around the globe , and the child sex trafficking and pornography which is silently abided in Hollywood, Washington, and in every government circle run by cabal-funded individuals. 
Look at the money usurped for the task of culling the masses, as former U.S. Secretary of State and presidential nominee, Hillary Clinton has stated : “This year, the United States renewed funding of reproductive healthcare through the United Nations Population Fund, and more funding is on the way. The U.S. Congress recently appropriated more than $648 million in foreign assistance to family planning and reproductive health programs worldwide . That’s the largest allocation in more than a decade – since we last had a Democratic president, I might add.” 
Furthermore, weather modification, or geoengineering , also known as chemtrails , additionally help the slow kill , or fast degeneration of the human species. NASA has admitted to using these weather altering programs, so there is no sense denying their presence. Aside from spraying lithium, strontium , barium, nano aluminum-coated fiberglass [known as CHAFF], radioactive thorium, cadmium, chromium, nickel, desiccated blood, mold spores, yellow fungus, and more, these chemical concoctions act as a global pandemic to further population control. 
Without mention of contaminated food, DARPA contrived control devices, and further attempts to make slaves of the remaining sheeple who live through these demonic efforts, know this; you are swimming in the depopulation agenda. The effects are all around you, and it is high time to put up some kind of resistance. Via Waking Times Image: sagesolar/Flickr Nathaniel Mauka is a researcher of the dark side of government and exopolitics, and a staff writer for Waking Times .",1
450,Voters Can Fight Back Against Election Fraud,nan,"Voters Can Fight Back Against Election Fraud November 08, 2016 Voters Can Fight Back Against Election Fraud 
Reports are already coming that there are attempts at voter fraud as Americans go to the polls on this Election Day. 
Some examples: TRUNEWS reported on how fake IDs are being used to influence election results 
As a voter, you have every right to assume that your vote is secure and counted fairly. Attempts to influence elections through voter fraud violate the rights of every informed citizen, and are a legitimate threat to the constitutional republic. 
What can you do? Fight back!! If you see voter fraud of ANY KIND, report it at your local polling station, and also to your STATE election board. 
Here is a list of phone numbers by state to report any suspected election fraud as you go to the polling booth: 
Alabama",1
