id,title,author,text,label
774,Концепция записка российского председательства,voltairenet.org,"Заседание Совета Безопасности от 28 октября 2016
Концепция записка российского председательства Сеть Вольтер | Нью-Йорк (США) | 27 октября 2016 français English Español عربي 中文 Сотрудничество Организации Объединенных Наций с региональными и субрегиональными орга-низациями в поддержании международного мира и безопасности: Организация Договора о коллективной безопасности, Шанхайская организация сотрудничества и Содружество независимых государств В качестве центрального мероприятия председательства Российской Феде-рации в Совете Безопасности планируем организовать 28 октября 2016 года деба-ты на тему «Сотрудничество Организации Объединенных Наций с региональны-ми и субрегиональными организациями в поддержании международного мира и безопасности: Организация Договора о коллективной безопасности, Шанхайская организация сотрудничества и Содружество независимых государств».
Глобальный характер современных вызовов и угроз, формирование коллек-тивных подходов, необходимых для их эффективного преодоления, диктуют необходимость наращивания сотрудничества между Организацией Объединен-ных Наций и региональными и субрегиональными организациями в области под-держания мира и безопасности.
Применительно к Организации Объединенных Наций это прежде всего ее универсальный характер как с точки зрения членства в Организации, так и ее де-ятельности, а также всемирно признанная легитимность. Региональные органи-зации, в свою очередь, зачастую обладают более тонким пониманием ситуации в зоне своей ответственности, а в целом ряде случаев — адаптированными к мест-ным реалиям превентивными и миротворческими механизмами. При этом важно, чтобы деятельность региональных организаций была направлена на поиск мир-ного, политического решения возникающих конфликтных ситуаций.
Именно в этом контексте высокую актуальность имеют регулярные «сверки часов» с основными региональными партнерами Организации Объединенных Наций в вопросах поддержания международного мира и безо-пасности. Так, Совет Безопасности на плановой основе проводит заседания по сотрудничеству с Африканским союзом, Организацией по безопасности и со-трудничеству в Европе, Европейским союзом. В последние годы проводился об-зор взаимодействия с Лигой арабских государств, Ассоциацией государств Юго-Восточной Азии, Союзом южноамериканских наций и другими «регионалами».
Как известно, сотрудничество между всемирной Организацией и регио-нальными партнерами включает в себя все более широкий круг проблем. K миро-творческим и миростроительным задачам добавились противодействие распро-странению оружия массового уничтожения и незаконным потокам легкого и стрелкового оружия, борьба c кибертерроризмом и нелегальной миграцией — области, где сотрудничество между рассматриваемыми организациями и Органи-зацией Объединенных Наций набирает обороты. Это имеет ключевое значение в плане поддержания мира и стабильности на широком пространстве Евразии, и в особенности в Центральноазиатском регионе.
Именно в этой сфере активны три относительно молодые организации, дей-ствующие в огромном регионе от Восточной Европы до Дальнего Востока: Орга-низация Договора о коллективной безопасности (ОДКБ), Шанхайская организа-ция сотрудничества (ШОС) и Содружество независимых государств (СНГ), — которые наращивают свой политический авторитет в мире и вносят большой вклад в укрепление региональной и международной безопасности.
В фокусе внимания в ходе дебатов будет вклад ОДКБ, ШОС и СНГ в проти-водействие угрозам миру и безопасности в регионе, в том числе в борьбу с тер-роризмом, наркотрафиком и организованной преступностью. Мероприятие также позволит подтвердить нацеленность этих трех объединений на развитие практи-ческого взаимодействия с Организацией Объединенных Наций, в том числе с ее Региональным центром по превентивной дипломатии для Центральной Азии.
ОДКБ — это многовекторная структура, способная уверенно реагировать на широкий спектр современных вызовов и угроз, с которыми могут столкнуться ее государства-члены. В этой связи перспективным видится углубление взаимодей-ствия между Организацией Объединенных Наций и ОДКБ в области миротворче-ства. В рамках ОДКБ ведется интенсивная работа по развитию собственного ми-ротворческого потенциала, в том числе для задействования в операциях Органи-зацией Объединенных Наций по поддержанию мира. Наряду c этим ОДКБ актив-но содействует международным усилиям по постконфликтному обустройству Афганистана, купированию исходящей c территории этой страны наркоугрозы.
Ее отношения с Организацией Объединенных Наций успешно развиваются по целому ряду направлений: противодействие терроризму и наркотрафику, ми-ротворчество, борьба с организованной преступностью. Поддерживаются и раз-виваются продуктивные контакты с профильными ооновскими структурами, включая Контртеррористический комитет Совета Безопасности и Управление Организации Объединенных Наций по наркотикам и преступности.
Каждые два года Генеральной Ассамблеей принимается резолюция о со-трудничестве Организации Объединенных Наций с ОДКБ. Подобную резолюцию планируется принять на семьдесят первой сессии Ассамблеи в рамках обсужде-ния пункта ее повестки дня, озаглавленного «Сотрудничество между Организа-цией Объединенных Наций и региональными и другими организациями».
Правовая база взаимодействия между Организацией Объединенных Наций и ШОС по вопросам международного мира и безопасности в соответствии с гла-вой VIII Устава Организации Объединенных Наций была заложена после подпи-сания в 2010 году совместной декларации о сотрудничестве между секретариа-тами двух организаций. В настоящее время между ШОС и Организацией Объ-единенных Наций налажено активное сотрудничество в таких областях, как предотвращение и урегулирование конфликтов, борьба с терроризмом (в этих це-лях в рамках ШОС действует Региональная антитеррористическая структура), нераспространение оружия массового уничтожения, противодействие транснаци-ональной преступности и незаконному обороту наркотиков, обеспечение между-народной информационной безопасности.
В данном контексте ШОС активно поддерживает усилия мирового сообще-ства и институтов Организации Объединенных Наций по восстановлению мира в Афганистане, последовательно выступает за сохранение центральной координи-рующей роли этой универсальной организации в процессе афганского урегули-рования.
Сотрудничество в обеспечении безопасности, противодействии современ-ным вызовам и угрозам всегда являлось и остается одной из приоритетных обла-стей интеграционного взаимодействия государств — членов СНГ.
Важным фактором активного противодействия возникающим угрозам явля-ется также конструктивное взаимодействие с международными организациями. Государства СНГ являются участниками всех важнейших международных доку-ментов, регулирующих сотрудничество в сфере обеспечения безопасности, разоружения, противодействия современным вызовам и угрозам, вносят реаль-ный вклад в их осуществление.
Совместные меры осуществляются с учетом ведущей роли Организации Объединенных Наций, необходимости развития конструктивного партнерства с другими международными институтами и их специализированными структура-ми, такими как Контртеррористический комитет, Управление по наркотикам и преступности, Международная организация уголовной полиции (Интерпол), Международная организация по миграции, Управление Верховного комиссара Организации Объединенных Наций по делам беженцев, Группа разработки фи-нансовых мер борьбы с отмыванием денег.
Как представляется, дальнейшее расширение и углубление взаимодействия Организации Объединенных Наций с ОДКБ, ШОС и СНГ на базе главы VIII Устава играет конструктивную роль в продвижении целей всемирной Организа-ции, включая преодоление современных вызовов и угроз. При этом, с одной сто-роны, эти региональные организации должны активно позиционировать себя с точки зрения задействования своего потенциала в интересах Организации Объ-единенных Наций. C другой — самой Организации Объединенных Наций следу-ет продолжать уделять необходимое внимание наращиванию координации и вза-имодействия c данными объединениями при строгом соблюдении прерогатив всемирной Организации и ее Совета Безопасности.
В этом контексте мы хотели бы предложить государствам — членам Орга-низации Объединенных Наций изложить собственное видение путей укрепления безопасности региона Евразии с опорой на имеющиеся региональные механиз-мы. Очевидно, что стабильность в этом макрорегионе станет фундаментом для экономического роста и государственного строительства стран Евразии; поэтому мы были бы признательны за соображения делегаций, в том числе и в плане увязки безопасности и развития. Убеждены, что здесь, в рамках всемирной Орга-низации, обладающей универсальной легитимностью, нам сообща будет по си-лам предложить инновационные подходы к вопросам стабилизации уязвимых ре-гионов, которые впоследствии могут быть применены и к другим частям плане-ты, находящимся в поле зрения Совета Безопасности.
В качестве докладчиков на дебатах выступят Генеральный секретарь Организации Объединенных Наций Пан Ги Мун, Генеральный секретарь ОДКБ Н. Н. Бордюжа, Генеральный секретарь ШОС Р. К. Алимов и заместитель Пред-седателя Исполнительного комитета СНГ С. И. Иванов. К участию в заседании приглашаются государства — члены вышеупомянутых региональных организа-ций и представители других заинтересованных государств.",1
775,"Bill Herz, Last of ‘War of the Worlds’ Broadcast Crew, Dies at 99 - The New York Times",Sam Roberts,"Bill Herz, the last surviving crew member of Orson Welles’s mock “War of the Worlds” newscast, which terrified American radio listeners in 1938 with vivid bulletins warning Newark residents to evacuate as invading Martians incinerated central New Jersey, died on May 10 in Manhattan. He was 99. The cause was complications of pneumonia, said Bill Kux, a cousin. Mr. Herz, who worked on other radio and theater productions as stage manager and casting director for Welles’s Mercury Theater company, staked one additional claim to fame. Until about six months ago, he had been a regular customer at Sardi’s restaurant, the   gathering place for celebrities and   tourists in the theater district, for some 82 years  —   beginning in 1933, just six years after it opened. That longevity alone distinguished him as a bon vivant in a shrinking cadre of original Broadway personalties. But he was also singled out periodically in the wider world as a relic of a bygone era, when a bogus radio news broadcast could provoke panic as war was brewing in Europe  —   however much that hysteria may have been overstated then and since. Welles’s CBS show “The Mercury Theater on the Air” presented an adaptation of the H. G. Wells novel “The War of the Worlds” for its Halloween episode on Sunday, Oct. 30, 1938. The live hourlong program began with an updated prelude to the original novel eerily warning that superintelligent beings had been coveting “this Earth with envious eyes. ” Then music, a weather report and other regular features were interrupted by simulated news bulletins and fake feeds from   operators in the field. Mr. Herz, playing Operators Three and Five, took part in this exchange: Operator Three: This is Newark, New Jersey.   …     This is Newark, New Jersey.   …     Warning! Poisonous black smoke pouring in from Jersey marshes. Reaches South Street. Gas masks useless. Urge population to move into open spaces.   …     Automobiles use Routes 7, 23, 24.   …     Avoid congested areas. Smoke now spreading over Raymond Boulevard.   …     Operator Four: 2X2L   …     calling CQ   …     2X2L   …     calling CQ   …     2X2L   …     calling 8X3R   …     Come in, please.   …     Operator Five: This is 8X3R   …     coming back at 2X2L. Operator Four: How’s reception? How’s reception? K, please. (Pause.) Where are you, 8X3R? What’s the matter? Where are you? John Houseman, Welles’s producer, wrote in his 1972 memoir, “ ”: “Our actual broadcasting time, from the first mention of the meteorites to the fall of New York City, was less than 40 minutes. During that time men traveled long distances, large bodies of troops were mobilized, cabinet meetings were held, savage battles fought on land and in the air. And millions of people accepted it  —   emotionally if not logically. ” (Mr. Houseman went on to a distinguished career in theater and Hollywood.) Mr. Herz also read Welles’s part, that of a Professor Pierson at a New Jersey observatory, during rehearsals. He said he was surprised by the public’s response to the radio show. “During the broadcast, outside, policemen were coming,” he told CBS News in 2013. “They were told on the radio that the Martians were coming, the Martians were coming!” (Later scholarship about the incident suggested that the broadcast provoked far less fear among the public than has been popularly portrayed.) In a 2010 profile in The New York Times, Mr. Herz was quoted as saying: “I had done Orson’s part in the dress rehearsal, and after I did it, I thought to myself, ‘Nobody’s going to believe this in a million years.’ Boy, was I wrong. ” William Herz Jr. was born in Detroit on Aug. 2, 1916, the son of Harold William Herz, a girdle salesman, and the former Fannie Lichtig. (Bill Herz called himself Jr. even though he wasn’t one.) He graduated from the Carnegie Institute of Technology (now Carnegie Mellon University) in Pittsburgh before moving to New York. He was briefly married to Susanne Guettel, whose brother Henry was a producer and film executive. No immediate family members survive. Mr. Herz had met Welles in Pittsburgh, where Welles, a young director at the time, had stopped while touring with a production of “Romeo and Juliet. ” They discovered that they had a common acquaintance in the actress Edith Meiser, a friend of Mr. Herz’s parents. Mr. Herz started working for Welles as a gofer. He later moved into Welles’s Manhattan home  —   Mr. Herz had been living with an aunt in Brooklyn  —   so that he could constantly be on call. They worked together on “Julius Caesar,” “The Cradle Will Rock” and “Too Much Johnson. ” Mr. Herz joined the Army Air Forces during World War II, managed a summer theater in Connecticut and produced and managed several plays in New York (including a few flops, one inauspiciously titled “The Strangler Fig”). After one failure, Vincent Sardi Sr. the founder of Sardi’s, generously invited him to keep an open tab in good times and bad. Another advantage to eating there was that Mackey’s Ticket Agency next door, where Mr. Herz later worked, had no restroom. Ivan Lesica, Sardi’s maître d’hôtel, said on Thursday that Mr. Herz would eat there once or twice a week and sit at Table Four, to the left of the dining room entrance, under his caricature. He would have coffee delivered in his own white mug, and typically order the chicken potpie or, appropriately enough for an habitué whom his cousin described as a confirmed curmudgeon, the crab meat sandwich.",0
