id,title,author,text,label
983,Detained Illegal Aliens End 3-Day Hunger Strike,Bob Price,"Illegal immigrants detained at the Northwest Detention Center in Tacoma, Washington, stopped a hunger strike shortly before Easter Sunday. The detainees demanded more money for doing chores, better food, and medical care. [Nearly 750 detainees reportedly refused their meals nearly half of the 1, 500 inmate capacity of the detention center. The hunger strike began earlier in the week on April 10 when some of the male detainees refused their lunches. Some women at the detention center later joined in the protest, the Seattle Times reported.  Protesters planned to fast for at least three days because the U. S. Immigration and Customs Enforcement (ICE) agency reportedly does not recognize hunger strikes that are any shorter. All but one detention   had stopped the strike by Saturday morning, said a spokeswoman for ICE. The detention facility was at the center of a publicized hunger strike in 2014 when Time reported that Paulino Ruiz “was sick of eating a boiled potato at every meal. ” He also reportedly claimed to be   with the $   he received for doing custodial chores. He further alleged harsh treatment by detention center personnel. Ruiz is a legal resident who came to the United States at the age of three. He was scheduled for removal by immigration officers after he served prison time for robbery. All but just a handful of inmates stopped their strike after it had gone on for more than a week, Time reported. Breitbart Texas reported in   that more than 60, 000 illegal aliens that were housed in a Colorado detention center are suing the federal contractor who operates the detention center. They allege the facility compelled “forced labor” in violation of federal human trafficking laws and are seeking money damages and restitution. Lawyers for the GEO Group, Inc. counter that no other court has ever recognized trafficking or unjust enrichment claims for cleaning bathrooms, serving meals, doing laundry, and performing other housekeeping duties. There is a supervised program of daily cleaning by all detainees, and GEO implements these requirements “through an   program. ” “Nobody trafficked them there,” the defendant argued in a motion filed with the court which authorized the class action lawsuit. Bob Price serves as associate editor and senior political news contributor for Breitbart Texas. He is a founding member of the Breitbart Texas team. Follow him on Twitter @BobPriceBBTX and Facebook. ",0
984,"US, Russia to Meet to Discuss Intermediate Nuclear Forces Treaty - Alex Gorka",nan,"Politics US, Russia to Meet to Discuss Intermediate Nuclear Forces Treaty 
The US has accused Russia of breaking the INF Treaty and summoned a special meeting, but as of yet Washington has provided no evidence of Russian violations Originally appeared at Strategic Culture Foundation 
The United States has called for a special meeting with Russia over alleged violations of the 1987 Intermediate-range Nuclear Forces (INF) treaty - a landmark Cold War-era agreement. 
Washington wants the Special Verification Commission (SVC) to discuss the problems related to the treaty’s compliance. The event is expected to take place in mid-November. The INF set up the Special Verification Commission as a way to deal with disputes surrounding the treaty. Ukraine, Belarus and Kazakhstan can also attend the meeting because they housed intermediate range missiles before the disintegration of the Soviet Union and remain parties to the treaty. No SVC meeting has been convened since 2003. 
Russia welcomes the United States' offer. «We have responded positively», said Mikhail Ulyanov, the head of Foreign Ministry's Non-Proliferation and Arms Control Department. 
The treaty, which bans testing, producing, and possessing ground-launched ballistic and cruise missiles with ranges between 500 to 5,500 kilometers, eliminated an entire class of missiles from Europe, and set up an extensive system of verification and compliance. 
Two years ago, the United States first asserted that Russia was in violation of the treaty, by developing a missile system that fell within the INF prohibitions. 
Last year, Rose Gottemoeller, the Under Secretary of State for Arms Control and International Security, said that Russia risked provoking «military and economic countermeasures» if it continued to stonewall the INF issue. 
The US has not released any specifics about which exactly Russian missile is the source of the violation. It should be noted that if Washington cannot present compelling evidence of the Russian non-compliance, the United States could be seen by the world as the party that killed the INF Treaty. The only thing the State Department has said is that an unspecified Russian ground-launched cruise missile breaches the agreement. 
The issue has been in focus of US media outlets recently. For instance, an article published by The New York Times on October 19 said « Russia appears to be moving ahead with a program to produce a ground-launched cruise missile». 
According to the article, «the concern goes beyond those raised by the United States in July 2014, when the Obama administration said that Russia had violated the 1987 treaty on Intermediate-Range Nuclear Forces». On the very same day, The Wall Street Journal chimed in saying «The US is escalating a dispute with Russia over its accusations that Moscow possesses banned missile technology». 
On October 17, two top House Republican chairmen - House Armed Services Committee Chairman Mac Thornberry (Texas) and House Intelligence Committee Chairman Devin Nunes (Calif.) – wrote a letter to the US president saying «It has become apparent to us that the situation regarding Russia’s violation has worsened, and Russia is now in material breach of the treaty». 
Russia, in turn, has accused the US of violating the pact. According to Russia’s officials, the Aegis Ashore missile defense system that the US has activated in Romania and plans to install in Poland represents a violation of the treaty. 
Aegis Ashore uses the naval Mk-41 launching system, which is capable of firing long-range cruise missile. This is a blatant violation of the INF Treaty provisions. 
The treaty bans launchers capable of firing intermediate range missiles. Mk-41s deployed in Europe may launch short and intermediate range cruise missiles deep into Russian territory. A US intermediate range weapon launched from Romania or Poland would require only a short flight time to reach beyond the Urals. Russia has also said that American armed drones violate the treaty. 
The US plans to arm tactical aviation in Europe with modernized B61-12 guided warheads will virtually nullify all the benefits of the INF Treaty from the point of view of Russia’s security. The aircraft could fly from bases in Lithuania, Estonia and Poland to Russia’s largest cities in 15-20 minutes – not that much longer than the flight time of the missiles scuttled by the INF treaty. 
If the US really wants the talks to produce a positive result, all these concerns should be part of the agenda. 
The SVC meeting will take place against the background of Russia’s withdrawal from the plutonium disposal deal with the US because of Washington’s non-compliance, recent movement of nuclear-capable Iskander missiles to Kaliningrad , rising tensions over NATO’s ground forces to deploy near Russian borders in 2017, US withdrawal from the agreement over Syria and apparent disintegration of arms control regime. 
Only political unity among the major global powers can reverse the disintegration process. Non-compliance, technical or material, is not the only problem the INF faces. Russia and the US adherence to the treaty’s provisions does not prevent other countries from efforts to acquire ground-based intermediate range nuclear capability. The treaty should become multilateral. Russia and the US could cooperate in an effort to reach this goal with the help of the United Nations. It may be kind of forgotten today as so many things have happened since then, but in October 2007 Russia and the United States issued a joint statement to call on all countries to join a global INF Treaty addressing the First Committee (Disarmament and International Security) of the UN General Assembly. 
Setting the existing differences aside, the parties could revive the process in an effort to involve other states. 
The SVC meeting may become a venue for addressing other issues related to arms control. The concerns are there. Candid talk is the best way to address the burning problems of mutual interest. 
The US has demonstratively refused to discuss the host of problems related to the ballistic missile defense in Europe. 
This stance is erroneous. The US should change its approach to the problem. The two great powers do need a venue for arms control dialogue. The reached agreement to restart contacts within the framework of SVC against the background of US presidential election gives hope that the tide may gradually turn.  ",1
985,"Breaking Silence, Officer Testifies About Killing of Walter Scott - The New York Times",Alan Blinder,"CHARLESTON, S. C.  —   The defendant, one of the most vilified police officers in recent American history, stood alone before a judge on Tuesday and made a simple declaration: He would testify in his own defense against the accusation that he had murdered an unarmed black man. Minutes later, that defendant, Michael T. Slager, the North Charleston police officer who shot and killed Walter L. Scott during a traffic stop and foot pursuit, ended nearly 20 months of silence and told a jury that he had been consumed by “total fear” in the moments before he opened fire on April 4, 2015. “I see him with a Taser in his hand as I see him spinning around,” Mr. Slager, 35, said as he described the fatal encounter with Mr. Scott, 50. “That’s the only thing I see: that Taser in his hand. ” But Mr. Slager also conceded that given the benefit of hindsight, the encounter could have ended much differently, with an outcome that did not leave a man dead and a police officer on trial for murder. “Going back 18 months later and looking at everything,” he said, “things could have been different. ” Still, to a prosecutor who was skeptical and sneering during the   Mr. Slager was a lawman with questionable judgment, a selective memory and a finger quick to pull the triggers of his Taser and his handgun. “It seems like you’re not remembering things that are bad for you,” said D. Bruce DuRant, the chief deputy solicitor for Charleston County. Before the jury of 11 white people and one black man, Mr. DuRant accused Mr. Slager of exaggerating the confrontation with Mr. Scott. “You’re starting to make up things as we go along, aren’t you?” he asked. Mr. Slager, who was fired after the shooting, said his recollection of the day was hazy or nonexistent. “I don’t remember everything that happened,” he said. The defense rested its case, and closing arguments were expected Wednesday, after which jurors are to begin deliberations. They will have a trove of evidence to weigh, including a bystander’s recording that showed Mr. Slager firing eight times at Mr. Scott’s back. If found guilty, Mr. Slager could be sentenced to life in prison. The jurors again saw the video,    at some moments, on Tuesday, as the man who recorded it, Feidin Santana, sat in the front row. Mr. Slager insisted that specific facts confirmed by the recording, including that Mr. Scott did not have the officer’s Taser when he was shot, were not apparent amid the stress and commotion of an encounter that occurred after Mr. Scott fled from a traffic stop for a broken taillight. Instead, Mr. Slager said that he thought Mr. Scott was “running for some reason,” and that he felt he was outmatched and “going to lose” the struggle with Mr. Scott. Soon, according to Mr. Slager, Mr. Scott seized the Taser and appeared ready to fire it. “I pulled my firearm, and I pulled the trigger,” said Mr. Slager, who said he suffered from nightmares after the shooting. “I fired until the threat was stopped, like I’m trained to do. ” By the time Mr. Slager squeezed the trigger of his Glock, Mr. Scott was at least 17 feet away, a distance Mr. Slager suggested he did not recognize in the chaos. Mr. Scott, whose family believes he initially fled because of unpaid child support obligations, crumpled to the ground. Not long after the shooting, Mr. Slager dropped his Taser next to Mr. Scott’s body, a decision he could not easily explain on Tuesday, but one that prosecutors view as proof that he was trying to plant evidence to cover up a murder. The murder statute in this state is a decidedly unembellished one: It defines murder as “the killing of any person with malice aforethought, either express or implied. ” Although prosecutors have not brought conspicuous evidence of racial animus on Mr. Slager’s part, they have depicted him as an officer who broke the law and local policies, including one that stipulates that “the preservation of life must always take priority over apprehension of criminals. ” Until the Saturday morning when he killed Mr. Scott, Mr. Slager had not fired his handgun while on duty. But to prosecutors, and to a defense team plainly worried about Mr. Slager’s being seen as a rogue officer, his history of using other types of force could be crucial to the jury. Part of that history, first detailed by The New York Times in May 2015, shows that Mr. Slager often relied on his Taser to defuse a situation. In 2014, for instance, he alone accounted for about 4 percent of Taser use by the police force in North Charleston. Under questioning, Mr. Slager denied that his Taser use was a reflection of his temperament. But he did say that Mr. Scott had behaved in ways that heightened his suspicions and fears. Mr. Slager also said that had he known about Mr. Scott’s limited criminal record  —   he was apparently flagged in a law enforcement database as a wanted person with “violent tendencies”  —   he would not have pursued him alone. As Mr. Slager neared the end of his testimony, he became emotional about the aftermath of the shooting. “My family has been destroyed by this,” he said. “The Scott family has been destroyed by this. It’s horrible. ”",0
986,The Onion’s Special Coverage Of Election Day 2016 - The Onion - America's Finest News Source,nan,"The Onion’s Special Coverage Of Election Day 2016 Pinned Articles 5:51 PM Report: Turnout Fairly Unattractive Throughout Suburban Philadelphia 
Our correspondents are reporting a steady turnout of homely and hideous residents throughout the suburban Philadelphia area that shows no signs of slowing down. In Montgomery County, polling places are said to be bustling with scores of schlubby, overweight voters, while Bucks and Delaware counties were reportedly busy all morning with an influx of unsightly, poorly groomed constituents, with many of the local oinkers having to wait upwards of an hour in line to cast their ballot. Overall, turnout in the area appears to be way uglier than analysts initially predicted. 
Compiled from reports out of The Onion’s Philadelphia bureau as part of our Precinct Watch initiative, dedicated to covering all voting rights obstacles encountered by the feckless and feeble-minded American electorate. The Onion 9:51 PM The Onion Calls Upon The Cowardly State Of Iowa To Stop Its Dithering And Declare Itself For One Candidate Or The Other 
With 42 percent of precincts reporting and the margin between the candidates holding at less than a percentage point, The Onion calls upon the spineless state of Iowa to quit its tarrying, pull itself together, and make a goddamn choice already. According to The Onion ’s electoral models, the Midwestern state needs to get its shit in order and figure out which way it’s going to go, because this isn’t even that complicated, for Christ’s sake. The Onion projects that the timid little Hawkeye State has 20 minutes or so to decide which candidate will get its six puny electoral votes, or we’ll just go ahead and call it for Jill Stein, and you’ll just have to deal with it. The Onion 9:46 PM Nation’s Optimists Need To Shut The Fuck Up Right Now 
WASHINGTON—Saying their rosy attitude about the state of the election was not helping anything given what is currently transpiring, sources confirmed Tuesday night that the nation’s optimists need to seriously shut the fuck up as soon as humanly fucking possible. “Sure, things may look bad right now, but even if the worst happens, it’s only four years we’re talking about here,” said Santa Fe, NM resident Pete Mirenge, one of hundreds of thousands of positive thinkers across the nation who would do everyone a huge goddamn favor by closing their fucking traps right this fucking second and keeping them sealed for the foreseeable future. “This is exactly why we have a system of checks and balances—to ensure that whatever happens in the election, the executive branch never gets too much power. Think about it: Has any president been able to carry out their platform to the letter? No. Nothing’s ever as bad as it seems, believe me.” According to sources, a calm and composed Mirenge—who reportedly has about five seconds before his mouth is shut for him—then added that the country’s been through much worse and everything turned out okay. 9:27 PM Tim Kaine Shows Hillary His Belly Button To Cheer Her Up After Losing Ohio 
After it was officially projected that Donald Trump would take the critical swing state of Ohio and its 18 electoral votes, vice presidential nominee Tim Kaine quickly ran over to a visibly disappointed Hillary Clinton and attempted to lift her spirits by pulling his shirt up above his midriff and showing her his belly button. The Virginia senator spent several minutes holding up the bottom of his shirt with his chin while repeatedly pointing at his navel and informing Clinton that he has “a innie [sic],” prompting Clinton to curtly nod and say “Yes, that’s right,” before craning her neck to look past him at the electoral map to track her progress in Florida and Nevada. 
Onion chief political correspondent Martin Hazelton is reporting live from Clinton HQ in New York City throughout the evening. The Onion Jill Stein Addresses Voters On Twitter The Onion 8:38 PM A Recap Of The Onion’s Exit Polls 
The Onion has been camped out at polling locations nationwide to collect the most accurate exit poll data and offer the only journalistic refuge in a world teeming with chaos and lies. Here are the highlights: The Onion 8:13 PM How Ordinary Americans Feel About What Remains Of This Country 
Every four years, against anyone’s better judgment, the American people are entrusted to elect the next president. The Onion let them tell their stories. 7:58 PM Clinton Leaves Office On Motorcycle To Hunt Down Precinct Leaders Who Haven’t Reported Yet 
With the majority of polls now closed across the country and no victor yet declared, Hillary Clinton reportedly left her campaign watch party moments ago, jumped on a red Suzuki Hayabusa motorcycle, and sped off to track down any precinct leader who has yet to report their county’s election returns. Secretary Clinton could be seen weaving between cars in Manhattan, driving on the sidewalk to get past several areas of heavy traffic, and then accelerating to speeds in excess of 110 miles per hour once she reached the interstate. Reporters were unable to keep up with the Democratic nominee, but numerous witnesses confirmed that Clinton had a baseball bat stowed next to her and appeared incredibly irate before she pulled down the tinted visor on her helmet, revved the motorcycle’s engine, and tore away. 
Onion chief political correspondent Martin Hazelton is reporting live from Clinton HQ in New York City throughout the evening. The Onion 7:51 PM Wolf Blitzer Walks Into Middle Of Olive Garden Commercial To Announce Breaking Election Results 
NEW YORK—Briskly striding into frame and interrupting a jubilant family meal, CNN anchor Wolf Blitzer reportedly entered the middle of an Olive Garden commercial airing during the network’s election coverage Tuesday night to announce a late-breaking election result. “Breaking news: CNN is calling Nevada for Hillary Clinton,” said Blitzer, stepping directly in front of a smiling mother passing a heaping plate of fettucine alfredo to her daughter and shushing the laughter of surrounding tables so that he could add that the victory dealt a severe blow to Donald Trump’s chances of reaching the Oval Office. “We are projecting that Secretary Clinton will take the crucial swing state’s six electoral votes, putting her on the inside track to securing the 270 electoral votes needed—hey, excuse me, will you please keep it down?—needed to win the presidency.” At press time, Blitzer was ducking in panic as the Olive Garden logo came swooping into frame. The Onion 7:36 PM Election Flashback: Nation Finally Shitty Enough To Make Social Progress (2008) 
WASHINGTON—After emerging victorious from one of the most pivotal elections in history, president-elect Barack Obama will assume the role of commander in chief on Jan. 20, shattering a racial barrier the United States is, at long last, shitty enough to overcome. 
Although polls going into the final weeks of October showed Sen. Obama in the lead, it remained unclear whether the failing economy, dilapidated housing market, crumbling national infrastructure, health care crisis, energy crisis, and five-year-long disastrous war in Iraq had made the nation crappy enough to rise above 300 years of racial prejudice and make lasting change. 
“Today the American people have made their voices heard, and they have said, ‘Things are finally as terrible as we’re willing to tolerate,” said Obama, addressing a crowd of unemployed, uninsured, and debt-ridden supporters. “To elect a black man, in this country, and at this time—these last eight years must have really broken you.” 
Added Obama, “It’s a great day for our nation.” ",1
987,Illegal Immigrant Allegedly Kills for Parking Spot,John Binder,"Following a fight outside a Texas nightclub, an illegal immigrant is now being accused of killing a man over a parking spot. [Jose Morales, a    from Guatemala, allegedly shot and killed    Mariano   after a fight outside the OK Corral night club, with two more men involved in the incident, according to KXAN News.  Investigators say that the four men first started fighting over parking spaces, with Morales and others in his car leaving the parking lot while   and individuals in his car followed them. While the two cars full of men drove away, they each started throwing bottles and other objects at each other, before pulling over and physically fighting. That is when investigators say   hit beat Morales’ vehicle with a baseball bat and then fled. Soon after, the two groups of men met at a nearby apartment complex, with Morales exiting his vehicle with a rifle, pointing it at the men and telling them he would kill them for beating his car. The car   was in tried to flee the scene, but ultimately got stuck while trying to get away from Morales. This is when police say Morales opened fire on the car, killing  . Morales fled the scene, but was arrested later on by the Lone Star Fugitive Task Force. Now, Morales is facing murder charges and the Immigration and Customs Enforcement (ICE) has a detainer on the illegal immigrant, meaning he will be deported if he is released from prison for any reason. John Binder is a contributor for Breitbart Texas. Follow him on Twitter at @JxhnBinder.",0
988,Writing with pen and paper hailed as latest twatty show-off thing to do,nan,"Writing with pen and paper hailed as latest twatty show-off thing to do 15-11-16 SITTING in a cafe with a notepad instead of a computer is the new twatty thing to do, it has been confirmed. All UK cafes now have at least one person staring listlessly at a Mac in them, prompting people at the cutting edge of cool to abandon their laptops for something simpler yet just as annoying. Self-proclaimed cool person Nikki Hollis said: “There’s something really soulless about looking at a screen when the beautiful world is happening all around you, which is why I’ve opted for this charming retro style of recording my important thoughts. “Having not actually written anything down for several years, my handwriting is comparable to that of a troubled six-year-old, but I find that it gives it a sense of childlike wonder. “I really love going back to basics, and for me writing a blog about internet marketing techniques in longhand has a beautiful authenticity to it. “It’s a massive waste of time because I still have to type it all up and email it to my boss when I get home, but I know I look winsome and cute chewing on a pen, which is something that you can’t really do with a laptop. “I know. I’ve tried.” 
Share:",1
