id,title,author,text,label
940,Brother of Clinton’s Campaign Chair is an Active Foreign Agent on the Saudi Arabian Payroll,# 1 NWO Hatr,"Free Thought Project – by Claire Bernish 
Tony Podesta — brother of the now-disgraced Hillary Clinton campaign chair John Podesta, whose files Wikileaks has been publishing — is not only a powerful Democratic Party lobbyist, but a registered foreign agent receiving a hefty monthly paycheck from the nefarious government of Saudi Arabia. 
No — as tinfoil-hat conspiracy theorist as it might sound — that scenario is the absolute truth. 
In 1988, John and Tony Podesta formed the Podesta Group and have used their bigwig party-insider status to lobby and influence government policies — while, at various times, simultaneously holding positions of power — which has created a number of glaring conflicts of interest. 
According to the March 2016 filing made in accordance with the Foreign Agents Registration Act of 1938, Tony Podesta is an active foreign agent of the Saudi government with the “ Center for Studies and Media Affairs at the Saudi Royal Court ,” and acts as an officer of the Saudi Arabia account. 
At this point, the web of pay-for-play between the Washington, political heavyweights, and foreign governments comes lurching into the spotlight. 
For starters, the Podesta brothers’ lobbying firm receives $140,000 every month from the Saudi government, which, in no uncertain terms — and despite a status as privileged U.S. ally — wages a bloody campaign of censorship, murder, suppression, human rights abuse, and worse against its civilian population, while bombing hospitals, schools, and aid convoys in neighboring nations. 
John Podesta previously served as President Bill Clinton’s chief of staff, founded the think tank Center for American Progress (which oh-so-coincidentally touts the need to reframe Saudi Arabia’s hopelessly tarnished image), counseled President Obama, and now chairs Hillary Clinton’s campaign. 
Tony Podesta acts as a foreign agent for the Kingdom of Saudi Arabia — lobbying to influence government policy in favor of the Kingdom — while also contributing to and bundling for Hillary Clinton’s campaign. 
Think about that for a moment. 
One brother uses the influence of money to both affect United States foreign policy and infuse the Clinton campaign with cash — while the other wields the influence of power as a political insider for the same entities. 
As the Washington Post reported months ago in July, Tony Podesta’s lobbying efforts “raised $268,000 for the campaign and $31,000 for the victory fund.” 
“The Saudis hired the Podesta Group in 2015 because it was getting hammered in the press over civilian casualties from its airstrikes in Yemen and its crackdown on political dissidents at home, including sentencing blogger Raif Badawi to ten years in prison and 1,000 lashes for ‘insulting Islam,’” Alternet reported . “Since then, Tony Podesta’s fingerprints have been all over Saudi Arabia’s advocacy efforts in Washington DC. When Saudi Arabia executed the prominent nonviolent Shia dissident Sheikh Nimr al-Nimr, causing protests throughout the Shia world and inflaming sectarian divisions, The New York Times noted that the Podesta Group provided the newspaper with a Saudi commentator who defended the execution.” 
Notably, the Saudis’ reputation has only worsened as further atrocities pile up — concerning not only a record number of barbaric beheadings this year, but suspiciously reckless and errant U.S.-backed coalition bombings of civilian sites in several regions of active conflict. 
Additionally, Tony Podesta’s status as a registered foreign agent for Saudi Arabia is at least obliquely discussed in an email from April 15, 2015 — ironically revealed by Wikileaks’ publishing of his brothers personal communiques — in which former Clinton Foundation chief development officer and now campaign national finance director Dennis Cheng wrote to a small group of insiders: 
“Hi all – we do need to make a decision on this ASAP as our friends who happen to be registered with FARA [Foreign Agents Registration Act] are already donating and raising. 
“I do want to push back a bit (it’s my job!): I feel like we are leaving a good amount of money on the table (both for primary and general, and then DNC and state parties)… and how do we explain to people that we’ll take money from a corporate lobbyist but not them; that the Foundation takes $ from foreign govts but we now won’t. Either way, we need to make a decision soon.” 
To which general counsel to the Clinton campaign, attorney Marc Elias, replied [all errors original and emphasis added], 
“Responding to all on this. I was not on the call this morning, but I lean away from a bright line rule here. It seems odd to say that someone who represents Alberta, Canada can’t give, but a lobbyist for Phillip Morris can. Just as we vet lobbyists case by case, I would do the same with FARA. While this may lead to a large number of FARA registrants being denied, it would not be a flat our ban. A total ban feels arbitrary and will engender the same eye-rolling and ill will that it did for Obama.” 
As the exchange continues, how to precisely handle the campaign’s image with potentially controversial donors — while, at all costs, maintaining the flow of cash — becomes even more apparent. As strategist and campaign manager Robby Mook responds, 
“Where do we draw the line though?” 
Elias suggests a particularly intricate solution: 
“If we do it case by case, then it will be subjective. We would look at who the donor is and what foreign entity they are registered for. In judging whether to take the money, we would consider the relationship between that country and the United States, its relationship to the State Department during Hillary’s time as Secretary, and its relationship, if any, to the Foundation. In judging the individual, we would look at their history of support for political candidates generally and Hillary’s past campaigns specifically. 
“Put simply, we would use the same criteria we use for lobbyists, except with a somewhat more stringent screen. 
“As a legal matter, I am not saying we have to do this – we can decide to simply ban foreign registrants entirely. I’m just offering this up as a middle ground.” 
Mook eventually decides plainly, 
“Marc made a convincing case to me this am that these sorts of restrictions don’t really get you anything…that Obama actually got judged MORE harshly as a result. He convinced me. So…in a complete U-turn, I’m ok just taking the money and dealing with any attacks. Are you guys ok with that?” 
All of this political wrangling appears to have had the desired effect — despite increasing calls for the United States to either rein in or sever completely its support for the bloody Saudi regime — the U.S. approved a stunning $1.29 billion sale of smart bombs to the Kingdom in November 2015. 
Tony Podesta’s specific contract with the government-run Center for Studies and Media Affairs at the Saudi Royal Court, which will earn $1.68 million by year’s end, does, indeed, suggest the infusion of a pro-Saudi message into the U.S. media propaganda machine. 
“Saudi Arabia is consistently one of the bigger players when it comes to foreign influence in Washington,” Sunlight Foundation spokesman Josh Stewart told the Washington Post . “That spans both what you’d call the inside game, which is lobbying and government relations, and the outside game, which is PR and other things that tend to reach a broader audience than just lobbying.” 
That broader audience — the American public — has indeed been manipulated courtesy of at least the thoroughly-corrupt Clinton campaign if not surreptitiously by the Saudis, as well. 
As The Free Thought Project has repeatedly reported , the evidence of collusion among the Democratic National Committee, Hillary Clinton’s campaign, and the mainstream presstitutes is indisputable — including no less than 65 so-called journalists listed by name in various leaks as darlings of the campaign. 
Although this level of corruption and collusion would be considered intolerable in nearly any other nation on the planet. And yet, at the center of this shit storm of contention is an official nominee for the White House — who will not be held responsible for any number of questionable and criminal acts. 
The system isn’t rigged — it’s performing exactly as intended — and always will as long as the vote validates its existence. Read more at http://thefreethoughtproject.com/clinton-podesta-campaign-saudi-arabia/#gYcjBFazk755MGcp.99 Share this:",1
941,‘We Must Fight Them’: Trump Goes After Conservatives of Freedom Caucus - The New York Times,Glenn Thrush and Jonathan Martin,"WASHINGTON  —   President Trump launched a vengeful tirade against conservatives in his own party on Thursday in an attempt to   health care talks and show that he remains a force to be feared in the looming battles over the budget, a tax overhaul and infrastructure. In an early morning Twitter attack, Mr. Trump singled out members of the House Freedom Caucus, which scuttled his health care overhaul last week. “The Freedom Caucus will hurt the entire Republican agenda if they don’t get on the team,  fast,” he wrote. “We must fight them,  Dems, in 2018!” He continued on Twitter throughout the day, naming individual members of the caucus, likening them to Democrats and urging other Republicans to “fight them” in the 2018 midterm elections if they do not back his agenda. But the Republican upstarts hardly cowered in the face of Mr. Trump’s criticism. They struck back, some of them ridiculing the president, using his own taunting and confrontational social media style. “Stockholm Syndrome?” Representative Tom Garrett of Virginia asked on Twitter, suggesting that the president had become captive to the Republican establishment he attacked during the campaign. “It’s a swamp not a hot tub. We both came here to drain it. #SwampCare polls 17%. Sad!” wrote Representative Thomas Massie of Kentucky, who often sides with the caucus on votes, mocking the president’s    campaign pledge. This was the moment when Mr. Trump, riding a wave of populist anger, was supposed to be at his most fearsome  —   enforcing discipline on his fragmented party. But in the wake of last week’s stunning defeat of legislation to replace the Affordable Care Act, which further eroded his already flagging poll numbers, Mr. Trump has made an abrupt shift from courting his party’s most conservative lawmakers to hurling threats at them, a vivid illustration of his difficulties uniting a   Republican Party. “Intimidation may work with some in the short term, but it never really works in the long run,” said Representative Mark Sanford of South Carolina, who opposed the health overhaul pushed by the White House and written by House Speaker Paul D. Ryan. Mr. Trump and his team believe the Twitter attacks will   his   leverage in coming negotiations. It also has the added virtue of allowing the most expressive of presidents to give voice to his anger. And they were not done out of impulse. Mr. Trump’s advisers have become more involved in his   Twitter feed in the last few weeks, ever since his impetuous, conspiratorial posts about President Barack Obama’s supposedly wiretapping his phones touched off a   controversy. Stephen K. Bannon, Mr. Trump’s chief strategist, has counseled a tough tone with the rebels, instructing his staff to use Twitter as a rhetorical prod to keep the party in line. Dan Scavino, an aide who controls Mr. Trump’s official White House Twitter account, recently moved into Mr. Bannon’s West Wing office, where he closely monitors social activity by and about the president, according to two officials. A handful of people have always had access to Mr. Trump’s personal Twitter account, but in the weeks since the president’s accusation against his predecessor, there has been a stricter imposition by aides to make sure there is a strategic imperative behind his posts, according to two people briefed on the process. The cannon blasts at the House Freedom Caucus followed nearly a week of the president’s stewing about the debacle over his failed health care effort. He did not take the loss especially well. His aides quickly began discussions about reopening negotiations that would at least demonstrate a commitment to what in the past has been one of his party’s most urgent priorities. The House Freedom Caucus came away from the health care fight feeling emboldened, and Mr. Trump’s senior advisers are now mindful of the need to slow any momentum the group has going into other legislative battles, including the budget fight just four weeks away. The health care bill that the many House members rejected was extremely unpopular. Only 17 percent of Americans  —   and 41 percent of Republicans  —   supported the proposal, according to a Quinnipiac poll released last week. Presidents  —   from Franklin D. Roosevelt to Mr. Obama  —   have said they would campaign against rebels in their own parties, and the threats have mostly been empty. Mr. Trump seems especially   to follow through, senior Republicans say. Beyond blustery Twitter messages, he has so far not shown even a willingness to take them on. In the mostly conservative House districts where Mr. Trump could target lawmakers, voters are likely to be more in sync with their representatives, who felt that the rollback of the law did not go far enough, than their president, who simply wanted a win. When Mr. Sanford, fresh off helping torpedo his party’s health care bill, showed up at a Berkeley County Republican meeting in South Carolina on Saturday, he was met with applause and praise. “It’s fairly banal,” said Representative David Schweikert, Republican of Arizona and a member of the caucus, said of Mr. Trump’s attack. “We are used to it. It goes with the job. He is not the first president who has attacked us, just the first from our own party. ” If the back and forth between Mr. Trump and the House   inflamed tensions between the president and some of his most loyal, if not exactly ideologically aligned, congressional supporters, it bound the president more closely to Mr. Ryan, reinforcing the most unlikely of shotgun political marriages. “I understand the president’s frustration,” Mr. Ryan told reporters on Thursday when asked about the president’s morning Twitter attack. “I share frustration. ” All week, the White House lurched between battering conservatives and trying to win them over. On Wednesday  —   about 18 hours before Mr. Trump’s Twitter blast  —   senior officials invited two dozen leaders from conservative groups for a   session to plot a path ahead. Participants, who were instructed by the organizers of the event not to divulge details of the meeting, or even the groups attending, described the hourlong session as a welcome but long overdue policy discussion. It included a candid, polite airing of complaints that they have been largely left out of the loop on major administration decision making, according to people who attended. The meeting, put together by Mr. Trump’s conservative outreach director, Paul Teller, at the request of conservatives, included representatives of the Heritage Foundation, Americans for Limited Government and Judicial Watch, all of whom were critical of some administration policies, including the health bill. Thomas Fitton, the president of Judicial Watch  —   a conservative legal advocacy group that successfully sued the Obama administration for the release of Hillary Clinton’s State Department emails  —   made a pointed pitch for the release of all documents pertaining to Russia’s interference in the election campaign controversy, according to people who attended the session in the Eisenhower Executive Office Building beside the White House. Mr. Fitton, the participants said, told Mr. Teller that the president needed to be committed to a policy of extreme transparency about contacts between Russian government officials and Trump associates during the 2016 campaign, including Michael T. Flynn, the former national security adviser, and Jared Kushner, Mr. Trump’s   . He also asked Mr. Teller and other administration officials present to more rapidly approve   Freedom of Information requests about Russia and other topics  —   likening the   on legally mandated disclosure to what he said was the Obama administration’s flouting of immigration laws. An activist in attendance said that Mr. Teller nodded, took notes and was noncommittal. Mr. Trump’s targeting of the Freedom Caucus came on a day of an unexpected change in his senior staff. Katie Walsh, a deputy to Reince Priebus, the White House chief of staff, announced her sudden departure after less than three months on the job to work for a “super PAC” allied with Mr. Trump. The White House offered no explanation for the timing of her departure.",0
942,"ISIS Kidnaps, Kills at Least 30 Civilians in Afghanistan",Jason Ditz,"Locals Say as Many as 42 May Have Been Killed in 'Revenge' Attack   26, 2016 Share This 
Underscoring the group’s growing presence around Afghanistan, ISIS has launched a mass kidnapping and execution in Afghanistan’s Ghor Province today, rounding up and shooting dozens of civilians who were gathering firewood in the hills. 
The victims were nomads from the Kuchi group, and while it was initially thought the attack might’ve been part of an ethnic conflict in the area over sheep ownership, it has since been attributed to ISIS, who officials say has a growing presence in the area and a bone to pick with the Kuchi. 
That the victims were nomads is making it hard to nail down exactly how many people were killed, with official reports saying it was at least 30, and locals saying as many as 42 were missing and presumed to have been killed in the attack. 
Ghor is far afield from the areas ISIS has been previously reported to have a major presence in Afghanistan. Early on they were claimed to be confined to the Nangarhar Province, but have also set up some territorial possessions in the far south.  ",1
943,Holding Hillary Accountable,EdJenner,"Go to Article 
This week’s WikiLeaks dump provided further sordid details about the Clintons’ breathtaking corruption—something nobody reasonable has doubted for quite some time. As expected, the Clinton camp’s response is to dismiss, distort, diminish, dodge, and divert. They do so in easy reliance  ",1
944,BREAKING : TED CRUZ CALLS FOR SPECIAL PROSECUTOR TO INVESTIGATE HILLARY – TruthFeed,Amy Moreno,"BREAKING : TED CRUZ CALLS FOR SPECIAL PROSECUTOR TO INVESTIGATE HILLARY BREAKING : TED CRUZ CALLS FOR SPECIAL PROSECUTOR TO INVESTIGATE HILLARY Breaking News By Amy Moreno November 3, 2016 
The Trump train is peaking at the perfect time. 
Donald Trump is leading in most polls, and gaining in key BLUE states, like Michigan, where he is within one point of Crooked Hillary. 
Clinton is plagued by endless scandals, lies, and two criminal investigations. 
The reopening of her email investigation after FBI officials discovered 650K emails on her top aide’s computer, and the FBI investigation into the scam Clinton Foundation. 
Today, Trump supporter Ted Cruz tweeted out a call for a special prosecutor to investigate the Clinton scandals. RT if you agree there needs to be a special prosecutor to investigate and prosecute the corruption of Hillary Clinton! 
— Ted Cruz (@tedcruz) November 3, 2016 This is a movement – we are the political OUTSIDERS fighting against the FAILED GLOBAL ESTABLISHMENT! Join the resistance and help us fight to put America First! Amy Moreno is a Published Author , Pug Lover & Game of Thrones Nerd. You can follow her on Twitter here and Facebook here . Support the Trump Movement and help us fight Liberal Media Bias. Please LIKE and SHARE this story on Facebook or Twitter. ",1
