id,title,author,text,label
759,"All Governments Lie, The Movie",David Swanson,"October Boomerang ‹ › David Swanson is an author, activist, journalist, and radio host. He is a 2015 Nobel Peace Prize Nominee. He is director of WorldBeyondWar.com and campaign coordinator for RootsAction.org . He hosts Talk Nation Radio . Talk Nation Radio is on VT Radio and is syndicated by Pacifica Network. The show also airs on WTJU, Charlottesville, VA; WCSX-Detroit, MI; KGHI, Westport, WA; WHUS, Storrs, CT; WPRR, Grand Rapids, MI; KRFP-LP, Moscow, ID; KZGM, Cabool, MO; KMUD, Garberville, CA; WAZU, Peoria, IL; WXRD, Crown Point, IN; Geneva Radio, Geneva, NY; KKRN, Round Mountain, CA; KSKQ-LP, Ashland, OR; WUOW-LP, Oneonta, NY; No Lies Radio, Pinole, CA; WYAP-LP, Clay, WV; The Detour, Johnson City, TN; WZRD, Chicago, IL; WEFT, Champaign, IL; WXPI, Pittsburgh, PA; WDRT, Viroqua, WI; Veracity Now, online; Liberty and Justice Radio, Shirley, MA; Ithaca Community Radio, Ithaca, NY; WMCB, Greenfield, MA; PRX.org; KAOS 89.3fm, Olympia, WA; WUSB 90.1 FM, Stony Brook, NY; WOOL-FM, Bellow Falls, Vermont; WSLR-LP 96.5 in Sarasota, Florida. He also blogs at DavidSwanson.org and WarIsACrime.org And is a prolific author. His latest books are; War Is A Lie , Daybreak: Undoing the Imperial Presidency and Forming a More Perfect Union , and When the World Outlawed War Swanson holds a master's degree in philosophy from the University of Virginia. He has worked as a newspaper reporter and as a communications director, with jobs including press secretary for Dennis Kucinich's 2004 presidential campaign, media coordinator for the International Labor Communications Association, and three years as communications coordinator for ACORN, the Association of Community Organizations for Reform Now. Read his full and complete biography at DavidSwanson.org and also visit book site at War Is Crime . All Governments Lie, The Movie By David Swanson on October 31, 2016 A Film About Liars and the Journalists That Expose Them 
By David Swanson 
Picture, if you will, video footage of vintage (early 2016) Donald Trump buffoonery with the CEO of CBS Leslie Moonves commenting on major media’s choice to give Trump vastly more air time than other candidates: “It may not be good for America, but it’s damn good for CBS.” 
That’s the introduction to a powerful critique of the U.S. media. A new film screens in New York and Los Angeles this week called All Governments Lie: Truth, Deception, and the Spirit of I.F. Stone . 
The website AllGovernmentsLie.com has screening dates , a list of lies , and a list of good journalists who expose lies . The lists on the website are not identical to the content of the film, but there’s a good deal of overlap — enough to give you a sense of what this project is about. 
I’d have made various changes and additions to the film. In particular, I’m tired of all the focus on Iraq 2003. This film touches on war lies since then, but still gives that one particular set of war lies prominence. 
Still, this is a film that should be shown in cities, homes, and classrooms across the United States. It includes and is driven by Noam Chomsky’s analysis of how the media system is “rigged” without those doing the rigging believing they’ve done anything at all. It’s a survey of skullduggery by corporate media. It’s an introduction to numerous journalists far superior to the norm. And it’s an introduction to I.F. Stone. It includes footage of a presentation of the annual Izzy Award which goes to journalists acting in Stone’s tradition. 
One of the lies listed in the film and on the website is that of the Gulf of Tonkin (non-)Incident. Anyone paying attention knows of it now as a war lie. And it was a transparent war lie at the time in a particular sense. That is: had the North Vietnamese really shot back at a U.S. ship off their coast, that would not have been any sort of legal, much less moral, justification for escalating a war. I’d love it if people could grasp that logic and apply it to the Black Sea, the Red Sea, and every other part of the earth today. 
But the Gulf of Tonkin lies about Vietnamese aggression against the U.S. ships innocently patrolling and firing off the coast of Vietnam were not transparent to people with faith in the U.S. role of Global Policeman. Someone had to make the lies transparent. Someone had to document that in fact the Secretary of So-Called Defense and the President were lying. Sadly, nobody did that in the first 24 hours after the Congressional committee hearings, and that was all it took for Congress to hand the president a war. 
And it was decades before White House transcripts came out and before the National Security Agency confessed, and additional years before former Secretary Robert McNamara did. Yet, those revelations simply confirmed what people paying attention knew. And they knew it because of I.F. Stone who just weeks after the (non-)incident published a four-page edition of his weekly newsletter exclusively about Tonkin. 
Stone’s analysis is useful in looking at the incident or lack thereof this past month in the Red Sea off Yemen. And in fact it is to Yemen that Stone immediately turned on page 1 in 1964. The United Nations, including its U.S. ambassador, had recently condemned British attacks on Yemen that Britain defended as retaliatory. President Dwight Eisenhower had also warned the French against retaliatory attacks on Tunisia. And President Lyndon Johnson, even at the time of Tonkin, Stone notes, was warning Greece and Turkey not to engage in retaliatory attacks on each other. 
Stone, who tended to look even at written laws that nobody else paid any heed to, pointed out that three of them banned these sorts of attacks: the League of Nations Covenant, the Kellogg-Briand Pact, and the U.N. Charter. The latter two are still theoretically in place for the U.S. government. 
The United States in Vietnam, Stone goes on to show, could not have been innocently attacked but itself admitted to having already sunk a number of Vietnamese boats. And indeed the U.S. ships, Stone reports, were in North Vietnamese waters and were there to assist South Vietnamese ships that were shelling two North Vietnamese islands. And in fact those ships had been supplied to South Vietnam by the U.S. military and the good old American tax payers. 
Stone did not have access to closed committee hearings, but he hardly needed it. He considered the assertions made in speeches by the only two senators who voted against the war. And then he looked for any rejoinders by the chairmen of the committees. He found their denials to be non-denials and nonsensical. It made no sense that the U.S. ships simply happened to be randomly hanging around in the vicinity of the South Vietnamese ships. Stone didn’t believe it. 
Stone also filled in the background information. The United States had been supporting guerrilla attacks on North Vietnam for years prior to the non-incident. And Stone raised numerous suspicions, including the question of why the U.S. ships had supposedly made sure they were out in international waters for the (non-)incident to (not) occur, and the question of why in the world Vietnam would take on the United States military (something nobody could explain, though Eugene McCarthy proposed that perhaps they had been bored). 
Missing from the film and website of All Governments Lie is I.F. Stone’s work on lies about the outbreak of the Korean War. We’ve learned more since he wrote it, but seen little more insightful, relevant, or timely for our understanding of Korea and the world today. 
David Swanson is an author, activist, journalist, and radio host. He is director of WorldBeyondWar.org and campaign coordinator for RootsAction.org . Swanson’s books include War Is A Lie . He blogs at DavidSwanson.org and WarIsACrime.org . He hosts Talk Nation Radio .He is a 2015 and 2016 Nobel Peace Prize Nominee. 
Follow him on Twitter: @davidcnswanson and FaceBook . 
Help support DavidSwanson.org, WarIsACrime.org, and TalkNationRadio.org by clicking here: http://davidswanson.org/donate .",1
760,"Trump and Brexit Defeat Globalism, for Now Anyway",Daily Bell Staff,"Trump and Brexit Defeat Globalism, for Now Anyway   14, 2016 
Trumpism as a stress test for democracy …. A series of populist anti-globalism shocks is a test for Western democracies. Trump’s stunning ascent to the White House is the clearest signal yet of an anti-establishment revolt unfolding in major democracies, stretching across the Atlantic. – Swiss Info Tech 
Was Trump’s victory actually created by the very globalist elites that Trump is supposed to have overcome? 
There are some who believe the elites are actually splintered into numerous groups and that domestic US elites have positioned themselves against the banking elites in London’s City. We see no fundamental evidence of this. 
The world’s real elites in our view may have substantive histories in the hundreds and thousands of years. US elites are basically in the employ of a handful of families, individuals and institutions in our view. 
It is confusing because it is hard to tell if Hillary, for instance, is operating on her own accord or at the behest of higher and more powerful authorities. 
It is probably a combination of both but at root those who control central banks are managing the world’s move towards globalism. History easily shows us who these groups are – and they are not located in America. 
This is a cynical perspective to be sure, and certainly doesn’t remove the impact of Trump’s victory or his courage in waging his election campaign despite what must surely be death threats to himself and his family.. 
But if true, this perspective corresponds to predictions that we’ve been making for nearly a decade now, suggesting that sooner or later elites – especially those in London’s City – would have to “take a step back.” 
More: 
The vote to propel Trump to the US presidency reflects a profound backlash against open markets and borders, and the simmering anger of millions of blue-collar white and working-class people who blame their economic woes on globalisation and multiculturalism. 
“There are a few parallels to Switzerland – that the losers of globalisation find somebody who is listening to them,” said Swiss professor and lawyer Wolf Linder, a former director of the University of Bern’s political science institute. 
“Trump is doing his business with the losers of globalisation in the US, like the Swiss People’s Party is doing in Switzerland,” he said. “It is a phenomenon which touches all European nations.” 
Again, this article presumes that Trump has “won” and that he intends to attack the larger globalist enterprise and the bankers funding it. On the other hand, it could be that both Trump and Brexit have been engineered to look as if the tide is turning against globalism when it is not. 
Why would those in charge want to portray this point of view when it may not be so? Because of what we call the “Internet Reformation” that has blasted open the secretive manipulations of the globalist elite in the past decade or so. 
It is almost impossible for globalists to promote internationalist memes in this environment. Yet it is the secretive injection of internationalist memes into the body politic that moves society toward the globalist enterprise. 
As we have suggested before, it is perfectly possible that a decision has been made to pretend to grant the larger society a “victory” over internationalism. 
Following this analysis, certain trends would be identified and encouraged that would seem to portray globalism as falling back on its metaphorical heels. 
In truth, if this analysis is correct, globalism’s retreat is a kind of pretense that will steer society less obviously in a globalist direction. 
One way this could happen is by ensuring the splintering of Europe – but not in a way that actually reduces control from Brussels. It will APPEAR to be so but won’t actually happen. The same thing could take place in the USA under Trump. 
Again, this is not to say that Trump is party to this plot or even approves of it. But the idea that Trump is part of a co-option is certainly a feasible alternative to an alternative analysis that takes what is happening at face value. 
Nonetheless, even if an alternative elite strategy has been decided on to realize globalism in another fashion, it ought to be pointed out that things have changed. And the Internet and its revelations are surely responsible. 
This is a very big deal and it is one that ought to be emphasized repeatedly. Brexit and Trump could be, somehow, the result of a different elite approach – but the approach HAS changed nonetheless. 
Think of it this way: Hillary represented the blunt approach toward the realization of further globalism. Her way included an aggressively expanded war and the pursuit of other globalist trends. 
Trump, rhetorically anyway, has a different approach in mind that would gut many internationalist trends. 
If Trump follows through on his rhetoric, the trend toward an internationalist world will be reduced. And while there is controversy over Trump’s recent staff appointments we should also bear in mind that the Trans Pacific Partnership (TPP) and the Transatlantic Trade and Investment Partnership (TTIP) both seem to be failing now. 
If indeed Trump’s election has damped the progress of TPP, and TTIP, this is a huge event. As we’ve pointed out, both agreements effectively substituted technocratic corporatism for the current sociopolitical model of “democracy.” 
The elites were trying to move toward a new model of world control with these two agreements. This is similar to what happened after the advent of the Gutenberg Press when the elites of the day moved away from royal control and apparently swapped in democracy. 
It seems evident that internationalism is now going to take a longer time to realize than we thought. However, this observation may not be entirely accurate if Trump turns out to be something other than his rhetoric suggests – or if Brexit is denied in Europe. 
Additionally, one of the elite’s most powerful, operative memes today is “populism vs. globalism” that seeks to contrast the potentially freedom-oriented events of Trump and Brexit to the discarded wisdom of globalism. See here and here. 
The reality of these two events, the victories of both Trump and Brexit, stand as signal proof that elite stratagems have been defeated, at least temporarily. Though whether these defeats have been self-inflicted as part of a change in tactics remains to be seen. 
Conclusion: But the change has come. One way or another the Internet and tens of millions or people talking, writing and acting has forced new trends. This can be hardly be emphasized enough. Globalism has been at least temporarily redirected",1
761,"Facing Congress, Some Sports Officials (Not All) Begin to Confront Sexual Abuse - The New York Times",Juliet Macur,"WASHINGTON  —   It must have been uncomfortable for Rick Adams, chief of Paralympic sports for the United States Olympic Committee, to sit between two gymnasts during the congressional hearing about sexual abuse on Tuesday. To his right, Jamie Dantzscher started crying during her testimony. She described how she was molested by the former U. S. A. Gymnastics national team doctor Larry Nassar when she was a teenager. Dantzscher, 34 and a former Olympian, said Nassar abused her “all over the world. ” “In my own room, in my own bed, in my hotel room in Sydney at the Olympic Games,” she said, through tears. “I thought I was the only one. ” To Adams’s left, Jessica Howard, a former national champion in rhythmic gymnastics, testified that Nassar began assaulting her when she was 15, during what he called therapy for a hip injury. “He began to massage my legs, and then quickly moved inwards on my thighs,” she said. “He then massaged his way into me. ” Give these women credit for telling their stories. They’re a main reason Senator Dianne Feinstein, Democrat of California, decided to introduce a bill that would make it mandatory for national governing bodies of Olympic sports to report sexual assault to the police. It would be a federal crime not to report abuse. Give Adams credit, too. In the past, the Olympic committee had failed to prioritize the issue of sexual assault and appeared to turn a blind eye to the issue by handing it off to the governing bodies of each Olympic sport. But on Tuesday, finally, Adams said something that was a long time coming. He said sorry. “The Olympic community failed the people it was supposed to protect,” said Adams, the head of organizational development for the national governing sports bodies, which exist under the umbrella of the United States Olympic Committee. “We do take responsibility, and we apologize to any young athlete who has ever faced abuse. ” Nassar was fired by U. S. A. Gymnastics in 2015 and is currently in jail in Michigan, where he is facing multiple sexual assault charges and federal child pornography charges. He has denied any wrongdoing. You would think U. S. A. Gymnastics would also go out of its way to apologize for its role in a scandal that has shaken Olympic sports and caused the ouster of its president, Steve Penny. More than 80 athletes have accused Nassar of abusing them. But the gymnastics organization did not even have a representative in that Senate Judiciary Committee hearing room. Feinstein had asked U. S. A. Gymnastics to testify, and said its board chairman, Paul Parilla, was thinking about it but backed out. Instead, Parilla provided a statement. It said that the board of directors offered “our sincere and heartfelt regrets and sympathies” to any athlete harmed and that U. S. A. Gymnastics was “appalled that anyone would exploit a young athlete or child in the manner alleged. ” No apologies. Court documents released this month showed U. S. A. Gymnastics had complaint files on 54 coaches regarding sex abuse claims from 1996 to 2006. No apologies, even for its lack of a backbone and for sending only a lobbyist to the hearing. That lobbyist first identified himself as working for U. S. A. Gymnastics  —   which I figured, considering he was holding a file folder that said, “USAG 50 copies” on it. A few minutes later, he said, no, he was actually there for U. S. A. Hockey. The federation has had no shame, either. When the sex abuse bill was introduced, Penny and others from U. S. A. Gymnastics met with Feinstein about the federation’s sexual assault policies. How about this for a   stunt: Tagging along was Mary Lou Retton, the smiling, bubbly sweetheart from the 1984 Games, as they said that the federation’s policies were solid and that gymnastics was a happy, safe place. On Tuesday, Feinstein and her fellow senators weren’t thrilled that the gymnastics federation had ditched them this time. “If they really cared, they would be here,” Senator Richard Blumenthal, Democrat of Connecticut, said as he looked at Dantzscher and Howard, the abused gymnasts who testified. “They have to answer for what happened to you. ” At a news conference later, Blumenthal called for an investigation into “who knew what and when. ” Feinstein said she would like to see the gymnastics board of directors change and for its replacement to be people who make the sexual assault issue a priority. The U. S. O. C. should hasten that change. It can do so by decertifying U. S. A. Gymnastics, which would basically kick the federation out as the national governing body for the sport of gymnastics in the United States. To let U. S. A. Gymnastics back into the family, the Olympic committee could demand that the federation clean house and start new with fresh faces. The committee has used this power with other federations, and it used its influence to push out Penny when the Nassar case exploded into one of the biggest abuse scandals in sports history. It might as well go a step further, if only to show athletes and other federations that it won’t tolerate sexual abuse on its watch. When asked if U. S. A. Gymnastics knew about the abuse of gymnasts at the hands of Nassar, Feinstein said: “Do I believe they knew about it? Absolutely, yes, I do. ” But they didn’t report it, she said, and that’s the culture of the sport. If Feinstein’s bill passes, it would help change that culture. The new U. S. Center for SafeSport  —   a nonprofit formed to prevent and handle abuse in Olympic sports  —   should help, too, if it ever gets going the way it should. Last week, after many delays, including a struggle by the Olympic committee to find funding, the center finally opened for business. There should be a hotline for athletes and others to anonymously report abuse in Olympic sports. Good luck finding it on the center’s website. Feinstein said the Olympic committee should easily find money to fund the site and keep it running, whether it’s through raising money from the private sector or using its own cash. “The Olympic committee has money, so they can use it the way they want to use it,” she said. Mattie Larson was sitting in the public seats at the hearing on Tuesday. She is 24 now, but I first met Larson, a senior at U. C. L. A. when she was 15, sometime before the 2008 Beijing Olympics. She was quiet, and a rising star. She said she was being molested by Nassar around that time. So many years later, in 2016, when The Indianapolis Star published an article about a gymnast who accused Nassar of abusing her, Larson’s former teammate on the national team called her and said, “Read the story and tell me what you think. ” The two said they realized that Nassar had abused them. It had never occurred to them that his   “intravaginal treatment” was sexual assault. After all, he was the head doctor for U. S. A. Gymnastics. If the federation trusted him, they should, too. Now Larson replays the abuse in her head, again and again. What could she have done to stop it? What should U. S. A. Gymnastics have done to stop it? “I’m mad at myself for not knowing,” she said of the abuse. “On so many levels, it was complete betrayal. “You’d think in a sport with young girls, with young girls wearing leotards, prancing around with their legs flying all over the place, that U. S. A. Gymnastics would educate gymnasts and coaches and parents about sexual abuse. But they didn’t. And they knew they should have. ” Larson said it could have saved her and others, countless others, if the U. S. Center for SafeSport had existed when she was competing. “There are so many more victims who haven’t come forward yet,” she said. “I know them. They’re national team members, Olympians. ” At the very least, U. S. A. Gymnastics or the United States Olympic Committee could have mandated sexual abuse awareness training for athletes and their parents. The committee didn’t require its national governing bodies to run abuse education programs, or even conduct criminal background checks, until 2014. When Adams was asked why so many years had passed with no independent entity like the SafeSport center, his answer was vague. “It took too long to happen,” he said.",0
762,Airbnb Ends Fight With New York City Over Fines - The New York Times,Katie Benner,"Airbnb has capitulated to the demands of lawmakers over its operations in New York City, the company’s largest market in the United States, agreeing to drop a lawsuit in which it was pushing back against a newly passed state law that it said could have hurt its business. The   home rental service on Friday settled the lawsuit that it filed against New York City two months ago. The suit challenged a New York law that Gov. Andrew M. Cuomo signed in October. That law called for fines of as much as $7, 500 for illegally listing a property on a rental platform such as Airbnb. The company had said the large fines could have deterred hosts and impaired its revenue in New York City. Hosts in the city generated about $1 billion in revenue last year, and the company took a cut of that in fees. But Airbnb on Friday agreed that it would drop the suit as long as New York City enforces the new law only against hosts and does not fine Airbnb. The settlement takes effect on Monday. The agreement is a victory for opponents of Airbnb. The company and New York authorities have battled for years over the legality of offering   lodging through the service, and the relationship has long been inconsistent. Since 2010, it has been illegal in New York to rent out a whole apartment on Airbnb for fewer than 30 days. In October, Airbnb said it was willing to crack down on people in New York City who rent out multiple homes, bowing to pressure from politicians and tenants’ rights groups who said the company had made it harder to find affordable housing in the city. “This is an astounding   on the part of Airbnb, which clearly recognized that this was a foolhardy and frivolous lawsuit,” Assemblywoman Linda B. Rosenthal, who wrote the law that Airbnb opposed, said of the settlement on Friday. In a statement, Airbnb said the settlement was “a material step forward for our hosts. ” Airbnb has been fighting with local governments around the globe that are displeased with the effects of the online rental service. Cities such as Amsterdam, Miami Beach and New Orleans have been closely watching the New York case. “I expect the city will now get down to the important business of enforcing the law against the serial lawbreakers on the site” who turn affordable housing into illegal hotels, Ms. Rosenthal said in her statement. “This is a win for everyone. ”",0
