id,title,author,text,label
465,Obama: Hillary Clinton Pardon Could Heal Divided Nation,Leigh Haugh,"Note to President Obama: a Hillary Clinton pardon could heal a divided nation. After all, if it was good enough for Richard Nixon, it is certainly good enough for Clinton. The difference being that Tricky Dicky was actually guilty of the crimes insinuated against him, whereas the former Secretary of State, who was thoroughly investigated and cleared of any criminal wrongdoing twice, continues to be maligned and persecuted by the right-wing establishment, as well as politicos with decades-old grudges who view the Clinton witch hunt as their opportunity to exact revenge on the woman who should be America’s first female President of the United States , and proved it by carrying the nation’s popular vote if not the antiquated electoral college.
As originally proposed by one-time presidential hopeful, Rev. Jesse Jackson, the nation should call upon President Barack Obama to issue a blanket pardon to the twice-exonerated Clinton, in order to call an end to the drawn-out attack on every aspect of the former New York senator’s character once and for all. In the 21st century, it is unthinkable to believe that U.S. citizens are so narrow-minded and circumspect that they seek to stop an empowered, idolized public servant from holding the highest office in the nation simply because she is a woman.
While it is abominable and heartbreaking to lend credence to this theory, there is strong evidence to support its existence, especially when considering some examples from other nations who have female world leaders:
— Indian Prime Minister Indira Gandhi (1966-77; 1980 to Oct. 31, 1984 (her assassination))
— British Prime Minister Margaret Thatcher (1979-90). Thatcher was the longest-serving British prime minister of the 20th century and first woman to have held the office.
— Israeli Prime Minister Golda Meir (1969-74)
— German Chancellor Angela Merkel (2005-present)
— Queen Elizabeth II of United Kingdom (U.K.), Great Britain, and Northern Ireland (1952-present)
— South Korean President Park Geun-hye (2013-present)
— Prime Minister Theresa May of U.K., Great Britain, and Northern Ireland (2016-present)
— Prime Minister Sheikh Hasina Wajed of Bangladesh (1996-2001; 2009-present)
From countries great and small, these women and countless others have achieved the ultimate seat of power in their respective nations. Some of these countries have a long, storied legacy of woman leaders that spans decades and even generations, while others are relatively new to welcoming a female presence as their central figurehead. Nonetheless, women all over the globe have been given the opportunity to lead their countries into a new era and provide their citizens with a different perspective, with the glaring exception of the United States, a nation that could benefit immensely from female influence at the helm.
Presidential pardons are not a foreign concept. Every U.S. president has the authority to grant pardons, which is also known as clemency, to anyone of their choosing. However, unlike most executive powers, presidential pardons are unchecked by Congress and cannot be blocked, overturned, or reviewed. The purpose of this power exists to help ease tensions, correct historic injustices, and heal political wounds. If any situation calls for its implementation, this scenario could not be more fitting. Yet, this authority does not come without controversy. In addition to President Gerald Ford’s pardoning of Richard Nixon in 1974, other controversial acts of clemency include President Bill Clinton’s pardon of Symbionese Liberation Army sympathizer and publishing heiress Patty Hearst in 2001, President Richard Nixon’s offer of clemency to Teamster boss Jimmy Hoffa in 1971, and President Jimmy Carter’s commutation of Watergate conspirator G. Gordon Liddy’s prison sentence in 1977.
As evidenced by the vitriol of the 2016 Campaign and subsequent General Election , a Hillary Clinton pardon by President Obama could be the only way to end the vicious cycle of recrimination and violence observed throughout the so-called Democratic process , which has encountered its own foibles and criticisms. Namely, the ongoing debate about the necessity of the electoral college and its all-or-nothing allotment, which many consider unjust and obsolete. Instead, many believe the winner of the popular vote should be elected as U.S. commander in chief, which would have resulted in President-elect Clinton occupying the Oval Office. In the aftermath of the controversial election results, a blanket pardon for the veteran politician could be the first step in healing a divided nation, which has truly demonstrated its fractured populace via the chaotic antics and disdainful actions observed throughout the extended 2016 Campaign cycle, as well as in the aftermath of its divisive conclusion.
Opinion Written and Edited by Leigh Haugh
Sources:
Personal Opinions and Observations of the Author
Detroit Free Press –Obama Should Pardon Hillary Clinton, Jesse Jackson Says
New York Times –Hillary Clinton, in Emotional Speech, Implores Supporters to Keep Believing in America
MTV –We Need Female Politicians Now More Than Ever
Washington Post –Here Are the Dozens of Democracies That Have Elected a Female Leader
All Article Images Courtesy of WikiMedia Commons – Creative Commons License clinton , Donald Trump , Hillary Clinton , jesse jackson , President Barack Obama , Presidential Pardons",1
466,Exceptional Handling,Jane Bailey,"Jane Bailey Jane Bailey is a self-published author of urban fantasy novels as well as a part-time blogger; in her day job, she works in SQA, where she sees plenty of WTFs. 
Enterprise Resource Planning software, or ERP for short, is crucial to the operation of many large businesses. Several popular ERP systems have plugin-friendly architecture, the better to sell upgrades their customers will never want or use. This software is primarily aimed at businesses with too many complex process flows to manage by hand—making it the perfect domain for a small, lean startup with 3 developers and 1 customer. 
Ethan and Roland were brand-new developers, fresh out of college and ready to take on the world. Patrick, a consultant, was more experienced, though still fairly early in his career. They worked in C# with the Visual Studio ecosystem, and their boss had bestowed just one instruction as to how their culture should be formed: 
""Picture a scale from 1 to 10, with 1 being fast and 10 being scalability and code quality and all that crap. I want you to aim for a 2."" 
Visual Studio is a great tool for beginning developers who need to work fast. It makes scaffolding the code simple and efficient, and allows for a drag-and-drop visual design that lets you rapidly prototype your screens. Couple that with great intellisense, and the team was confident they could deliver their addon as promised. 
That said, Visual Studio is also a complex piece of software, with many of its best features hidden inside a labyrinthine menu system and/or optional settings deep in a configuration file. It works better if you have time to learn how to use it. Unfortunately, our ERP team did not have that kind of time, and they missed a few key features. For example, out of the box, Visual Studio won't step into a catch block while debugging. You can debug catch blocks, but you have to explicitly set a breakpoint in them or they will be skipped entirely. There's an option to turn this behavior off, but it's hidden deep in the menus. 
Ethan and Roland developed a workaround for this behavior that let them continue working: they would comment out catch blocks surrounding code they were actively debugging, then restore the commented-out code afterward. But this took time and effort, and often multiple cuss-filled executions as they realized the exception was handled at a higher or lower level than they'd originally anticipated and they had to comment out more code. Finally, Patrick came up with a more creative solution: pre-emptively comment out all try-catch blocks in the entire solution, and stop adding more. 
""There's no time for exception handling,"" he scoffed. ""We have to move fast or we won't hit our street date."" 
Ethan was concerned by this solution. He'd already caught himself forgetting to un-comment catch blocks using their old strategy. Wasn't this infinitely more risky? And how would they know their catch blocks were written correctly? What about testing the error messages they were meant to display to the users? Still, he was brand new, and Patrick had industry experience, so he was overruled. 
The weeks wore on, and development moved at blazing speed. The developers did their own unit tests, and from time to time, their BA would perform manual tests of the addon installed in the ERP system. It mostly crashed, but it was early yet. There was time to figure it out. Still, blazing isn't quite lightspeed, and the BA kept finding more and more crucial functionality that would be required if anyone was going to be interested in purchasing the thing. The general feeling of the project team matched the immortal words of Sonic the Hedgehog: ""We're not going to make it. Let's speed up!"" 
The team took on more developers in an effort to increase overall velocity. One of these was Alex, a contractor with 30 years of experience handling IT projects. Alex rapidly emerged as the clear leader of the entire team; his age and experience dethroned even Patrick. He spent increasing amounts of time sequestered with the boss, talking through everything from planned features to plugin architecture to the speed of development, which the boss felt was responsible for their missed milestones. Not because the code quality was crappy and therefore more time was spent fixing bugs, but because developers ""weren't coding fast enough."" 
The codebase had grown from a few hundred lines to several thousand. Ethan had found the magic toggle for Visual Studio that made it step into catch blocks, much to his relief. He reported this to the boss, and the ban on exception handling was (begrudgingly) lifted. Ethan adjusted rapidly, but many of the other developers still blamed exception handling for the slowness of coding. Often the addon would crash due to an incorrect cast or bad index. However, handling exceptions was seen as wasted time, so many developers refused to do it. 
Upon overhearing the boss and Alex discussing the matter, Ethan threw in his two cents. ""We're nearing release. We should really start adding exception handling to all new code. Then we should do a final round of testing to make sure nothing breaks."" 
This didn't go over well with the boss. The solution was simple to him. ""Just don't use any exception handling. Remove all of it. Then we won't have to test anything extra, and we might even make our deadline."" 
Ethan, after retrieving his jaw from the floor, protested violently. ""Who's gonna pay for a system that crashes the moment you look at it wrong? What about data integrity? If bad data is persisted to the database, it'll fill up with garbage—and then the application will throw even more exceptions!"" 
""I know it's not ideal,"" said the boss, ""but there's no time. Remember the scale: we need to be at a 2, and you're at like a 6 right now. This is industry standard stuff. Trust me on this, okay?"" 
Time marched on. The company doubled in size, adding more developers who were forbidden from using exception handling. They moved even faster now, approaching the final ship date—well, the new final ship date, anyway. 
One day, while debugging, Ethan noticed that the addon didn't crash anymore, but did log an error to the console. ""Wait, what? Where was that handled?"" 
Concerned, he dug through the code. Most of his exception handling had been removed or commented out; he couldn't find a single catch block in the whole module he was working on. Finally, he found it: at the very top level, someone had put a try-catch block around the entry point to swallow any exceptions that were thrown. 
Ethan asked Alex about it the next time he caught him in the hallway. 
""Yeah, we can't have the addon crashing all the time, you know?"" Alex shrugged. 
Another junior developer poked his head out of a nearby cubicle. ""It turns out, in C#, if you have an exception, the entire application crashes! Crazy, right? I found that out last week, and I told Alex about it, so we decided to implement exception handling."" 
Ethan had no words at first. He just cradled his forehead in the palm of his hand. Finally, he tried one last time to explain. ""Look. Exception handling is a good idea. But this is going to swallow all the errors, so debugging will be impossible. At the very least, let's put a catch block around each module so we know which one failed. And stop removing my catch blocks!"" 
Alex shook his head. ""You just have to do it right. All of you,"" he added, raising his voice so the others could hear. ""If you just code it right from the start, there won't be exceptions, and handling them won't be necessary!"" 
Ethan learned a valuable lesson that day: why exactly it was that startup developers tended to congregate in bars and debate the merits of various fine liquors online. It wasn't that people who liked alcohol were drawn to software development. Working at places like this drove developers to drink. [Advertisement] Universal Package Manager - ProGet easily integrates with your favorite Continuous Integration and Build Tools, acting as the central hub to all your essential components. Learn more today!",1
467,Nota conceptual para la presidencia de Rusia,voltairenet.org,"Reunión del Consejo de Seguridad de 28 de octubre de 2016
Nota conceptual para la presidencia de Rusia Red Voltaire | Nueva York (EE.UU.) | 27 de octubre de 2016 français English русский عربي 中文 Cooperación entre las Naciones Unidas y las organizaciones regionales y subregionales en el mantenimiento de la paz y la seguridad internacionales: Organización del Tratado de Seguridad Colectiva, Organización de Cooperación de Shanghái y Comunidad de Estados Independientes Como actividad central durante su Presidencia en el Consejo de Seguridad, la Federación de Rusia tiene previsto celebrar un debate el 28 de octubre de 2016 sobre el tema “Cooperación entre las Naciones Unidas y las organizaciones regionales y subregionales en el mantenimiento de la paz y la seguridad internacionales: Organización del Tratado de Seguridad Colectiva, Organización de Cooperación de Shanghái y Comunidad de Estados Independientes”.
El carácter mundial de los desafíos y amenazas actuales y la elaboración de los enfoques colectivos necesarios para abordarlos eficazmente hacen necesario mejorar la cooperación entre las Naciones Unidas y las organizaciones regionales y subregionales en la esfera del mantenimiento de la paz y la seguridad.
Las Naciones Unidas pueden aportar, en primer lugar, su carácter universal, tanto en lo que respecta a su composición como a sus actividades, así como su legitimidad mundialmente reconocida. Por su parte, las organizaciones regionales suelen tener una comprensión más profunda de la situación en su ámbito de responsabilidad. Además, en muchos casos, estas cuentan con mecanismos de prevención y de mantenimiento de la paz adaptados a las realidades locales. Al mismo tiempo, es importante garantizar que las actividades de las organizaciones regionales estén dirigidas a hallar una solución política por medios pacíficos a los nuevos conflictos.
En este contexto se hace muy pertinente una “comparación de notas” sistemática con los principales asociados regionales de las Naciones Unidas sobre cuestiones relativas al mantenimiento de la paz y la seguridad internacionales. Por ejemplo, el Consejo de Seguridad celebra periódicamente reuniones sobre la cooperación con la Unión Africana, la Organización para la Seguridad y la Cooperación en Europa y la Unión Europea. En los últimos años se han realizado exámenes sobre las relaciones con la Liga de los Estados Árabes, la Asociación de Naciones de Asia Sudoriental, la Unión de Naciones Suramericanas y otras entidades regionales.
Como se sabe, la cooperación entre las Naciones Unidas y sus asociados regionales abarca un abanico cada vez más amplio de cuestiones. A las tareas de mantenimiento de la paz y consolidación de la paz, ahora se han sumado las de la lucha contra la proliferación de armas de destrucción en masa, las corrientes ilícitas de armas pequeñas y armas ligeras, el ciberterrorismo y la migración ilegal, ámbitos en los que la cooperación entre las Naciones Unidas y las mencionadas organizaciones está cobrando impulso. Esta cooperación reviste una importancia fundamental para el mantenimiento de la paz y la seguridad en todo el territorio de Eurasia y especialmente en la región de Asia Central.
Es precisamente en este ámbito en que trabajan tres organizaciones relativamente nuevas que operan en la vasta región que va desde Europa Oriental hasta el Lejano Oriente: la Organización del Tratado de Seguridad Colectiva (OTSC), la Organización de Cooperación de Shanghai (OCS) y la Comunidad de Estados Independientes (CEI). Estas organizaciones están consolidando su influencia política en el mundo y contribuyendo significativamente al fortalecimiento de la seguridad regional e internacional.
En las deliberaciones, se centrará la atención en la contribución de la OTSC, la OCS y la CEI a la lucha contra las amenazas a la paz y la seguridad en la región, en particular a la lucha contra el terrorismo, el tráfico de drogas y la delincuencia organizada. Este evento también ofrecerá una oportunidad a estas tres organizaciones para reafirmar su compromiso con el objetivo de establecer una colaboración práctica con las Naciones Unidas, en particular con su Centro Regional de las Naciones Unidas para la Diplomacia Preventiva en Asia Central.
La Organización del Tratado de Seguridad Colectiva (OTSC) es una estructura de vectores múltiples, capaz de responder resueltamente a la amplia gama de desafíos y amenazas que afrontan actualmente sus Estados miembros. En este sentido, la cooperación que se está desarrollando entre las Naciones Unidas y la OTSC en la esfera del mantenimiento de la paz tiene muy buenas perspectivas. La OTSC está trabajando intensamente para crear capacidades propias para el mantenimiento de la paz, que, entre otras cosas, se utilizarían en las operaciones de mantenimiento de la paz de las Naciones Unidas. Además, la OTSC contribuye activamente a las iniciativas internacionales encaminadas a la reconstrucción del Afganistán. La OTSC contribuye activamente a los esfuerzos internacionales para la reconstrucción del Afganistán y a la lucha contra la amenaza de las drogas provenientes del territorio de ese país.
Las relaciones entre la OTSC y las Naciones Unidas se han desarrollado con éxito en varios ámbitos, como la lucha contra el terrorismo y el tráfico de drogas, el mantenimiento de la paz y la lucha contra la delincuencia organizada. La OTSC mantiene y desarrolla contactos productivos con las estructuras especializadas de las Naciones Unidas, en particular el Comité contra el Terrorismo del Consejo de Seguridad de las Naciones Unidas y la Oficina de las Naciones Unidas contra la Droga y el Delito.
La Asamblea General aprueba cada dos años la resolución sobre la cooperación entre las Naciones Unidas y la Organización del Tratado de Seguridad Colectiva. Se ha previsto que en su septuagésimo primer período de sesiones, la Asamblea General aprobará una resolución sobre ese tema en el marco del debate sobre el tema del programa titulado “Cooperación entre las Naciones Unidas y las organizaciones regionales y de otro tipo”.
El marco jurídico para la cooperación entre las Naciones Unidas y la Organización de Cooperación de Shanghai (OCS) sobre las cuestiones relativas a la paz y la seguridad internacionales fue establecido, de conformidad con el artículo VIII de la Carta de las Naciones Unidas, tras la firma en 2010 de una declaración conjunta sobre la cooperación entre las secretarías de las dos organizaciones. En la actualidad, la OCS y las Naciones Unidas están cooperando activamente en ámbitos como la prevención y la resolución de conflictos, la lucha contra el terrorismo (la Estructura Regional contra el Terrorismo se ha establecido en el marco de la OCS con esa finalidad), la no proliferación de las armas de destrucción en masa, la lucha contra la delincuencia transnacional y el tráfico ilícito de drogas, y la protección de la seguridad de la información internacional.
En este contexto, la OCS apoya activamente las iniciativas de la comunidad internacional y las entidades de las Naciones Unidas para restablecer la paz en el Afganistán, y siempre ha estado a favor de que las Naciones Unidas mantengan su función de coordinación central en el proceso de solución afgana.
La cooperación para garantizar la seguridad y hacer frente a los desafíos y amenazas actuales ha sido siempre y seguirá siendo una de las esferas prioritarias de la cooperación integradora entre los Estados miembros de la Comunidad de Estados Independientes.
La cooperación constructiva de la CEI con las organizaciones internacionales es también un factor fundamental en la lucha contra las nuevas amenazas. Los Estados de la CEI son partes en todos los principales instrumentos internacionales que rigen la cooperación en las esferas de la seguridad, el desarme, y la lucha contra los desafíos y amenazas actuales, y contribuyen de manera efectiva a su aplicación.
En la aplicación de medidas conjuntas se tienen en cuenta la función rectora de las Naciones Unidas y la necesidad de establecer una asociación constructiva con otros organismos internacionales y sus estructuras especializadas, como el Comité contra el Terrorismo del Consejo de Seguridad, la Oficina de las Naciones Unidas contra la Droga y el Delito, la Interpol, la Organización Internacional para las Migraciones, la Oficina del Alto Comisionado de las Naciones Unidas para los Refugiados, y el Grupo de Acción Financiera sobre el Blanqueo de Capitales.
Seguir fortaleciendo y estrechando la cooperación entre las Naciones Unidas y la OTSC, la OCS y la CEI, sobre la base del artículo VIII de la Carta de las Naciones Unidas, contribuirá de forma constructiva al logro de los objetivos de las Naciones Unidas y, en particular, a la lucha contra los desafíos y amenazas actuales. En este contexto, estas organizaciones regionales, por una parte, deben posicionarse activamente de modo que pueda aprovecharse su potencial en interés de las Naciones Unidas. Por otra parte, las Naciones Unidas deben seguir prestando la atención necesaria al fortalecimiento de la coordinación y la cooperación con esas organizaciones, con estricta observancia de las prerrogativas de las Naciones Unidas y su Consejo de Seguridad.
En este sentido, quisiéramos proponer a los Estados Miembros de las Naciones Unidas que presenten su propia visión de los medios de fortalecer la seguridad en la región de Eurasia sobre la base de los mecanismos regionales existentes. Es evidente que la estabilidad en esta macrorregión sentará las bases para el crecimiento económico y la consolidación del Estado de los países euroasiáticos. Por esa razón, agradeceríamos que las delegaciones transmitieran sus consideraciones al respecto, en particular sobre la relación entre la seguridad y el desarrollo. Estamos convencidos de que aquí, en el marco de las Naciones Unidas, organización que goza de una legitimidad universal, podremos proponer de manera colectiva enfoques innovadores sobre las cuestiones relativas a la estabilización de las regiones vulnerables, que posteriormente podrán aplicarse en otras partes del mundo que sean objeto de la atención del Consejo de Seguridad.
En el debate formularán declaraciones el Secretario General de las Naciones Unidas, Excmo. Sr. Ban Ki-moon, el Secretario General de la Organización del Tratado de Seguridad Colectiva, Excmo. Sr. Nikolai Bordyuzha, el Secretario General de la Organización de Cooperación de Shanghai, Excmo. Sr. Rashid Alimov, y el Vicepresidente del Comité Ejecutivo de la CEI, Excmo. Sr. Sergey Ivanov. También están invitados a participar en la reunión los Estados miembros de las organizaciones regionales mencionadas y los representantes de otros Estados interesados.",1
