id,title,author,text,label
232,"Fed Raises Key Interest Rate, Citing Strengthening Economy - The New York Times",Binyamin Appelbaum,"WASHINGTON  —   The Federal Reserve raised its benchmark interest rate Wednesday for just the second time since the financial crisis of 2008, saying the American economy is expanding at a healthy pace and setting itself up as a counterweight to   Donald J. Trump’s push for considerably faster growth. The Fed cited the steady growth of employment and other economic measures, and signaled that it expects to raise rates more quickly next year to prevent the economy from growing too quickly. “My colleagues and I are recognizing the considerable progress the economy has made,” Janet L. Yellen, the Fed’s chairwoman, said at a news conference after the announcement. “We expect the economy will continue to perform well. ” The widely expected decision moves the Fed’s benchmark rate to a range of 0. 5 percent to 0. 75 percent, still very low by historical standards. Low rates support economic growth by encouraging borrowing and  . The American economy has expanded by about 2 percent a year over the last six years, and the unemployment rate has fallen to 4. 6 percent. The Fed’s assessment that the economy is growing at a healthy pace  —   not too hot, not too cold  —   is starkly at odds with Mr. Trump, who has promised 4 percent growth and has described job creation as “terrible” and economic growth as anemic. Already on Wednesday, one Republican member of the House Financial Services Committee, Representative Roger Williams of Texas, criticized the Fed’s move. “Today’s decision by the Fed to raise the interest rate is entirely premature and will be burdensome to a nation already struggling to pull itself out of this   Obama economy,” Mr. Williams said in a statement. “By making rates even higher, the Fed is effectively making our hardships even harder. ” Mr. Williams did not object when the Fed raised rates last December. In announcing the decision after a   meeting of the Fed’s   committee, the central bank gave little indication that Mr. Trump’s election had altered its economic outlook. The Fed said it still expected a slow economic expansion and a steady march toward higher rates. In separate forecasts also published Wednesday, Fed officials predicted three rate increases in 2017. For the first time in recent years, however, there is a real possibility of significant changes in fiscal policy. Republicans will control the White House and both chambers of Congress, and Mr. Trump has promised to increase economic growth and job creation through tax cuts and infrastructure spending. Those measures could spur faster growth after a presidential campaign in which Mr. Trump regularly disparaged the economy’s performance under President Obama. But the Fed reiterated Wednesday that the economy is already expanding at roughly the maximum sustainable pace. Fed officials also see evidence that the labor market is tightening. Several Fed districts reported labor shortages in the central bank’s most recent compilation of economic reports. In the Philadelphia district, construction workers are hard to find. Atlanta reported a shortage of nurses Kansas City, truck drivers Dallas, tech workers. Faster growth, in the Fed’s judgment, would probably lead to higher inflation. As a result, if Republicans succeed in invigorating growth, the Fed is likely to raise rates more quickly. The greater the stimulus, the faster interest rates are likely to rise. “Your expectation should depend very little on what you think that the F. O. M. C. is thinking and very much on your view of Trump policies and their macro effects,” said Jon Faust, a professor of economics at Johns Hopkins University and a former adviser to Ms. Yellen, referring to the Federal Open Market Committee. “Don’t focus on the Fed. As James Carville regularly reminded the other Clinton on the campaign trail: It’s the economy, stupid. ” Ms. Yellen emphasized that the Fed was not prejudging the likely course of events. She declined several times to comment on the merits of Mr. Trump’s plans or to predict their consequences for the economy. “We’re operating under a cloud of uncertainty at the moment,” Ms. Yellen said. Fed officials predicted that they would raise the Fed’s benchmark rate a little more quickly in the coming years, reaching 2. 1 percent by the end of 2018. In September, they had predicted that it would reach 1. 9 percent by the end of 2018. The new projections, however, reflect a significantly slower pace of increase than last December, when they expected the rate to reach 3. 3 percent by 2018. The combination of steady growth and faster rate increases indicates that some Fed officials expect the central bank to end up offsetting a modest increase in fiscal stimulus. But Ms. Yellen said most Fed officials were reserving judgment. “Changes in fiscal policy or other economic policies could affect the economic outlook,” she said. “Of course, it is far too early to know how those changes will unfold. ” The tensions between monetary and fiscal policy will develop slowly. Legislation takes time to write, and any economic impact would generally be felt in coming years. Political pressures, however, may build more quickly. Mr. Trump has made clear in the past that he likes low interest rates  —   and some of his plans, like infrastructure investment, will be much easier to fund if rates remain low. “The Fed is in a tricky place,” said Michael Feroli, chief United States economist at JPMorgan Chase. “They’re trying not to prejudge how Congress and the administration duke it out, but once they see that, I think they will respond. ” There is also uncertainty about the Fed’s leadership. Ms. Yellen’s term as chairwoman ends in February 2018, and Mr. Trump has said he would prefer a Republican. Ms. Yellen could remain on the board, a possibility she said Wednesday she had not ruled out. But the Fed, under different leadership, might well choose a different path forward. Some conservative economists, notably John Taylor of Stanford University, argue that the bank should already have raised rates above 1 percent. The economy, for now, keeps plodding along. Steady job growth has reduced the unemployment rate to a level the Fed considers healthy. A little unemployment is natural as people change jobs and businesses close. Ms. Yellen and other Fed officials have said they see some signs of stronger wage growth. Inflation, too, has picked up a little in recent months, although both wages and inflation continue to rise more slowly than the Fed would like to see. Ms. Yellen described the rate increase as “a vote of confidence in the economy. ” The decision was made by a unanimous vote of the 10 members of the Federal Open Market Committee, the first time in recent months the Fed has acted by consensus. Some economists argue that the Fed should wait until inflation strengthens before raising rates, to test whether a stronger economy would persuade some people sidelined during the downturn to start looking for jobs. That would expand the labor force. Unemployment remains particularly high among minorities. That view, however, has found little support among Fed officials, who worry that interest rates will have to be raised more quickly if they wait too long, increasing the chances of pushing the economy into recession. “Apparently, Fed officials think the economy is growing too quickly,” said Ady Barkan, the director of Fed Up, a coalition of liberal groups that has pressed the Fed to continue its stimulus campaign. “I doubt you can find many other Americans who share that opinion. And it’s a strange conclusion to draw in the wake of an election that was so heavily impacted by voters’ economic discontent. ”",0
233,"La expresión “no, lo siguiente” ya es la más utilizada no, lo siguiente, en el castellano",Xavi Puig,"La expresión “no, lo siguiente” ya es la más utilizada no, lo siguiente, en el castellano SE HA HECHO VIRAL NO, LO SIGUIENTE Real Academia de la Lengua 
El uso de la expresión “no, lo siguiente” ha aumentado no, lo siguiente, en los últimos cinco años. “La gente es bastante fan no, lo siguiente, de esta expresión que lo está petando”, concluía esta mañana la Real Academia de la Lengua (RAE) en la presentación de su informe “Una lengua viva no, lo siguiente”. 
“Quien acuñara esta forma de hablar la ha liado porque se ha hecho viral”, insisten los académicos, que certifican que el castellano es la lengua más hablada no, lo siguiente, después del chino e incorpora constantemente “formas de expresión que se convierten en memes porque las emplean usuarios que son prescriptores y tienen la tira de seguidores”. 
“Es un zasca en toda regla al castellano normativo”, confirman los expertos. 
“También te digo: un día estas aquí y otro allí”, reza el informe de la RAE, refiriéndose a numerosas expresiones que antes molaban pero que “por hache o por be han dejado de estar en el candelabro y al final a la gente se la sudan”. 
La entidad ha animado a todos sus seguidores a compartir esta nueva información en su muro y a darle a RT.",1
234,"As Trump Berates News Media, a New Strategy Is Needed to Cover Him - The New York Times",Jim Rutenberg,"Well, that sure escalated quickly. “That” was Donald J. Trump’s inaugural news conference as a duly elected United States    in which he called BuzzFeed a “failing pile of garbage,” dismissed CNN as “fake news” and more or less told the whole lot of reporters at Trump Tower to stuff it when it comes to his unreleased tax returns because everyday Americans don’t care and, anyway, “I won. ” There were two big lessons in the Wednesday morning melee. 1. Mr. Trump remains a master media manipulator who used his first news briefing since July to expertly delegitimize the news media and make it the story rather than the chaotic swirl of ethical questions that engulf his transition. 2. The news media remains an unwitting accomplice in its own diminishment as it fails to get a handle on how to cover this new and wholly unprecedented president. It better figure things out, fast, because it has found itself at the edge of the cliff. And our   (fingers crossed) democracy needs it to stay on the right side of the drop. Journalists should know this by now: Trump’s gonna Trump. But it’s time for them to take a page from the   playbook  —   accept the things they cannot change and then find the courage to change the things they can, in the right ways, not the wrong ways. Given Mr. Trump’s past behavior, there was hardly any doubt that he was going to kneecap his inquisitors on Wednesday. It’s a passion, after all, if not a strategic imperative. But BuzzFeed handed him the steel rod hours before, with its decision to publish an unvarnished dossier filled with unsubstantiated, compromising reports about Mr. Trump allegedly collected by Russian agents, presumably for blackmail purposes. BuzzFeed said it was “publishing the full document so that Americans can make up their own minds about allegations about the   that have circulated at the highest levels of the U. S. government. ” Ben Smith, the BuzzFeed editor in chief, wrote that “we have always erred on the side of publishing” and that “publishing this dossier reflects how we see the job of reporters in 2017. ” Mr. Smith’s stated rationale highlights the extent to which WikiLeaks and Gawker, which is now defunct, have changed the nature of journalism. Both have at times taken a “publish first, fill in the answers  —   or don’t  —   later” approach, but they held particular, outsider roles in the journalistic firmament. And both have run into great trouble because of their   styles, in Gawker’s case, fatally (if wrongfully). BuzzFeed, under Mr. Smith, has built up a fine traditional news team that has won journalism awards precisely because it succeeded in the ultimate purposes of its craft: to establish fact from fiction and enhance its readers’ understanding of reality. That’s the opposite of pumping out a bunch of unsubstantiated allegations and then leaving it to readers to “make up their own minds” about them with no reportorial guidance. You can argue that the dossier was going to get out there anyway. But it hadn’t until BuzzFeed published it, even though many news organizations, including this one, had the dossier for months. And had they leaked by some other means, it would be up to journalists to establish their veracity ignore them if possible, debunk them if necessary. That’s what BuzzFeed has done with its   reporting on the “fake news” phenomenon, helping to shine an early light on the false stories so many Americans were sharing on Facebook and other social media platforms throughout the campaign. But every journalistic misstep gives more fodder to people who want to stop the efforts against “fake news” by turning the tables and labeling those efforts  —   or any other solid journalism they don’t like  —   as “fake news” as well, corrupting the term for their own purposes (a classic case of “no, you are! ”). That’s what Mr. Trump did Wednesday morning. In calling BuzzFeed a “failing piece of garbage,” Mr. Trump gave it a cri de coeur. But there was collateral damage: Mr. Trump’s “fake news” charge against CNN, in front of many millions of Americans, went directly at the network’s core purpose as a global news provider. CNN drew Mr. Trump’s hostility by breaking the news on Tuesday that a former British spy had compiled the Russia dossier and that intelligence officials included a synopsis of it in briefing materials for the  . Once CNN opened the door, BuzzFeed followed by publishing the document itself. But as CNN pointed out, it did not share the details of the memos, and it did not even link to the BuzzFeed report, despite false claims to the contrary by Kellyanne Conway, Mr. Trump’s adviser. Its decision, the network said, was “vastly different than BuzzFeed’s decision to publish unsubstantiated memos. ” That, in turn, drew protest from Mr. Smith of BuzzFeed, who said he was “not going to participate in an attempt to divide the media against each other. ” And so, Mr. Trump won again, by succeeding in doing just that. It was all part of a show in which he used news organizations as props in their own lampooning while he played them off each other with labels of good and bad and selectively answered their policy questions. A united front would have given the reporters stronger footing. But that was woefully lacking when Mr. Trump shouted down Jim Acosta of CNN, who said Mr. Trump’s press secretary, Sean Spicer, threatened to eject him. The other reporters in the room readily took Mr. Acosta’s place, happy to have their own questions answered. But they could be next. They’re going to have to decide how much they want to abide by Mr. Trump’s decision to selectively quarantine colleagues whose coverage he does not like. There is some precedent for doing the right thing here, from the early days of the Obama administration, when it questioned Fox News’s credentials as a “news organization. ” That was followed by an attempt by the Treasury Department to exclude Fox News from a round of interviews, which the rest of the news media resisted. Speaking in Fox News’s defense, Jake Tapper, then of ABC News, publicly criticized the administration for its effort to exclude “one of our sister organizations. ” So it was fitting that, later on Wednesday, Shepard Smith of Fox News got behind CNN. “It is our observation that its correspondents followed journalistic standards and that neither they nor any other journalists should be subjected to belittling and delegitimizing by the   of the United States,” he said on his program. (The same couldn’t be said for his colleague, the opinion host Sean Hannity  —   proudly “not a journalist”  —   who on Wednesday night celebrated the news briefing as “the single greatest beatdown of the   abusively biased mainstream media in the history of the country. ”) Mr. Acosta, interestingly, made history last spring by becoming the first American journalist to ask a question of a Cuban leader, Raúl Castro, since the earliest days of the Castro regime. It was a hopeful sign of a new day for press freedom in the restrictive communist country. His   with Mr. Trump, on the other hand, is a bad sign for press freedom at home. The news media can’t afford a backslide. It’s going to have to do its part to avoid one.",0
235,‘Sunk Costs’: $58 Billion Wasted On Imaginary Weapons Since 1997,nan,"Get short URL 0 37 0 0 A new government report released this week states that the Pentagon spent at least $58 billion over the last 20 years on weapons systems that not only were never built, but often never made it past the design phase. 
The report, released by the Undersecretary of Defense for Acquisition, Technology and Logistics, Frank Kendall, is an internal review of the Defense Department’s acquisition activities, and contains a chart of 23 pricey projects that received billions in initial funding but were later canceled. The report shows this happening as far back as 1997. © REUTERS/ Master Sgt. Kevin J. Gruenwald Pentagon Prepares to Start Raqqa Offensive Within Weeks 
The Army’s Future Combat System was one of the most expensive of the doomed military-money pits, costing over $20 billion, with the RAH-66 Comanche attack and reconnaissance helicopter second with a $9.8 billion price tag before operations were ceased. Taken together these two programs account for 50 percent of what was deemed “sunk costs,” according to the Washington Examiner . The $3.7-billion National Polar-orbiting Operational Environmental Satellite System, the $2.7-billion Lockheed Martin VH-71 helicopter, and the $2.5-billion JLENS air-defense blimp are a few of the other pricey and failed ventures detailed in the report. 
Out of 23 projects, eight were able to spend all of their allocated money before the plug was pulled. ...",1
236,Changing the Montenegrin leader does not change the ideology,nan,"Changing the Montenegrin leader does not change the ideology   Source: Submitted By Milko Pejovic The statement of the Prime Minister of Montenegro Milo Djukanovic concerning his resignation and the transfer of powers including the formation of a new parliament is actively discussed In Montenegro. Despite a positive outcome for the opposition forces the situation has not changed. Djukanovic explained his resignation by an anti-governmental conspiracy involving foreign intelligence services and the Serbian minority. Under the pretext of dealing with “conspirators” arrests of opposition leaders and activists are being continued in the country. The story about the arrest of “terrorists” who were planning to capture state institutions of Montenegro on the night of 17 October is still discussed in media. Special public prosecutor of Montenegro Milivoje Katnich declared the disclosure of this crime’s plan. However, after a few days weapons seized from the militants were not found in the stock where they were delivered. According to workers of the Prosecutor’s office the weapons were destroyed according to the order of Katnich. The elimination of the main evidence is at least a strange decision. A few days after the elections opposition activists Željko Šćepanović and Gordan Konatar were detained on suspicion of financial fraud. According to law enforcement they had a large amount of money with them. Šćepanović is s member of the party “Movement for Change” and is a relative of Nebojsa Medojevic who is one of the leaders of the DF. The persecution affected not only active participants in the political process but also Aron Shaviv who is the adviser of the DF. Pro-government media ganged up on him with “accusatory” articles. Representatives of law enforcement agencies staged a covert persecution. Anonymous letters are being sent via email and SMS to regular citizens who support the political initiatives of the “Key” and the “Democratic Front” and other parties. Montenegrins are forced to hide their political commitment to the opposition. Activists objectionable to Djukanovic’s regime are under strict ideological pressure from the authorities and law enforcement agencies. Montenegro has long been a police state where it is dangerous to tell the truth, where political changes in the management team does not improve the situation.  ",1
