id,title,author,text,label
262,"At Chatsworth House, a Tale of Five Centuries - The New York Times",Elizabeth Paton,"LONDON  —   If walls could talk, Chatsworth House, with its sublime Painted Hall, Sculpture Gallery and endless parade of gilded staterooms, would have some tales to tell. Considered one of the great treasure houses of England, set amid the rolling green hills of the Derbyshire Dales, the estate has played host over the last 500 years to some of Britain’s most captivating and infamous women, including: Bess of Hardwick Mary, Queen of Scots Georgiana, Duchess of Devonshire Kathleen Kennedy, known as Kick (sister to John F. Kennedy) and Deborah Mitford, known as Debo. Their stories, and much more, will be revealed as part of an exhibition, “House Style: Five Centuries of Fashion at Chatsworth,” which opens to the public on Saturday. Curated by Hamish Bowles, international editor at large at American Vogue, and with creative direction and design by Patrick Kinmonth and Antonio Monfreda, the exhibition will delve into Chatsworth’s rich sartorial heritage, using the lives of its   inhabitants and their glamorous guests as mannequins on which to hang stories of the wider history of the house. “To be let loose in the wardrobe rooms, the gold vaults, the muniment room and the closets, cupboards and attics of Chatsworth  —   a place I came to as a little boy with a ticket in my hand and wonder in my eyes  —   has been a truly joyous experience,” Mr. Bowles said recently in a telephone call from the stately home. Lady Laura Burlington, the    of the current Duke and Duchess of Devonshire, conceived of the exhibition while hunting for a christening robe. She found umpteen perfectly preserved options complete with capes, underdresses and bonnets, which led her to wonder what else might lie undiscovered. Six years later, Mr. Bowles has seen his curatorial vision become a reality. The exhibition is organized by theme, including Coronation Dress Bess of Hardwick and the Tudor Influence the Georgiana Effect and Country Living and Entertaining at Chatsworth, though a standout moment for him may be a reimagining of the Devonshire House Ball, situated in the grandest staterooms in the house. Held in 1897 to celebrate Queen Victoria’s Diamond Jubilee, the ball, with 400 guests dressed as allegorical figures (and, crucially, photographed) was the grandest fancy dress ball of the century. Assistant curators for the exhibition spent months tracking down a handful of the original costumes, bringing them together for the first time since the night of the party. Mr. Bowles gasped as he described a Zenobia, Queen of Palmyra, gown made by the couturier   Worth for Louise, the formidable wife of the eighth duke, and arguably the jewel in the display’s crown. “So often,” Mr. Bowles said, “clothing is the most vivid entry point into getting a sense of how people of the past lived and existed in an environment or even a single moment in time. To create this exhibit on the landscape of Chatsworth, where so many legendary lives and moments have unfolded, has just been extraordinary. ” Lady Burlington, a former model and fashion buyer, said that her first meeting with Mr. Bowles was less than auspicious. “We met many years ago on an   fashion shoot for Harper’s and Queen,” Lady Burlington said, “where Hamish was the stylist, I was the model, and thanks to an overly snug Vivienne Westwood corset, I promptly fainted. ” Mr. Bowles helped revive her, she added, by giving her a cup of tea and a biscuit. Luckily, their next meeting proved more fruitful. Beyond the historical gems they unearthed, the exhibition is notable for its wealth of contemporary contributions, with garments from modern fashion labels like Alexander McQueen, Erdem, Maison Margiela, Vetements, Vivienne Westwood and Gucci, the exhibition’s principal sponsor. Last year, Gucci shot its 2017 cruise collection at Chatsworth, and the house clearly made its mark on the creative director Alessandro Michele, who said it was “unlike anywhere else in the world, full of charm and rituals. ” “You can see history everywhere,” Mr. Michele said, “yet everything is alive. ” The most recent Gucci runway collection was packed with what Lady Burlington termed “Chatsworth detail,” including fabrics, colors and bejeweled bugs and bees crawling over suiting and shirts. Given the calligraphy offerings on the Milan runway last month, Mr. Michele may also have been taken with the 11th duke’s trove of novelty slogan pullovers, printed with phrases like “Get Up and Do Something,” “Far Better Not” “All Passion Spent” and “Never Marry a Mitford. ” The duke’s wife, Debo Mitford (one of six Mitford sisters who dominated British high society in the 1930s) died in 2014, but she is represented in the exhibition. An ice pink satin “Carmel” gown she commissioned from Dior from its spring 1953 collection is a centerpiece of the show, while other highlights include her collection of bug and butterfly brooches and a pair of her favorite slippers, emblazoned with the image of Elvis Presley. Lady Burlington added wistfully that there might have been even more from the dowager duchess in the exhibition had she not willingly given away so many treasures. “Debo kept some things for sentimental reasons but generally thought nothing of passing clothes on,” she said. “As a result, her garments could turn up in the most unlikely of places. ” Lady Burlington recounted a story told by Charlotte Mosley about a time when the author had attended the local nativity performance alongside the duchess. The two had been sitting there for some time before the dowager suddenly sat upright in her chair, her eyes lit up. “Oh my goodness, I can’t believe it,” Lady Burlington said, repeating the account of the duchess’ reaction. “The Angel Gabriel is in my Givenchy!”",0
263,The Uncomfortable Love Affair Between Donald Trump and the New England Patriots - The New York Times,Mark Leibovich,"“I’m not talking politics at all,” Tom Brady said in response to the first of several questions about, predictably, politics. Brady has been getting a lot of these, beginning with Super Bowl week’s Opening Night on Monday at Minute Maid Park in Houston. This is not your average    Super Bowl week in America. The chaos in Washington, bedlam at airports and protests across the country serve as an unsettling crowd noise to even the serene superstar quarterback for the New England Patriots. Brady is friends with President Trump. So are the Patriots’ owner, Robert Kraft, and Coach Bill Belichick. No sports team has been more closely associated with a new president, or perhaps any president, at least since Richard Nixon very publicly adopted the Washington Redskins as his own and even called occasional plays for Coach George Allen. Like Trump, the Patriots are a divisive juggernaut that tend to engender strong passions for and against. The team represents a kind of sporting ideal of Trump’s promise to make “America win so much, you’ll be bored of winning. ” New England, which will appear in an N. F. L.  ninth Super Bowl on Sunday, is a team that wins so much that a lot of America has become, yes, bored of its winning. And no small number of fans are convinced that the Patriots (like Trump) achieve their victories through dubious means and wish they would just go away and get off their TVs forever. The three main architects of the team’s success  —   Kraft, Belichick and Brady  —   have taken pains to emphasize that their allegiance to Trump is based on friendship and loyalty, nothing more. They play golf and attend weddings and call to congratulate one another on elections and Super Bowl wins, those kinds of everyday things. They are quick to assert their bipartisan or apolitical bona fides. Kraft has been a supporter of many Democrats and Democratic causes over the years Belichick declared himself apolitical in response to queries last fall after Trump at a campaign rally in New Hampshire read aloud from an effusive note of congratulations that Belichick had sent him. Brady started getting questions about Trump last fall when a red “Make America Great Again” cap was spotted in his Gillette Stadium locker, reportedly put there by Kraft. Brady at first gave sheepish,   responses suggesting that it would be cool to have a golf pal as president. (“There’d be a putting green on the White House lawn,” he predicted.) But the questions took on an edgier urgency as Trump’s victories and offenses kept mounting  —   ending with Trump where he is now, and Brady dropping into a reflexive   every time Trump’s name is mentioned to him. Brady, whose makeshift podium on the Minute Maid field on Monday night was swarmed with a few hundred reporters, was the central battlefield of incoming   questions. He countered with his most anodyne deflections. “I’m just a positive person” became Brady’s   blow off, which he also deployed in the face of several questions about Deflategate, the     scandal given new life this week by the prospect of Commissioner Roger Goodell’s having to award the Super Bowl trophy to the man he suspended for four games to begin this season. Other Atlanta Falcons and Patriots players were also invited to weigh in on political matter but mostly demurred. The Falcons receiver Mohamed Sanu, a practicing Muslim, was asked to discuss Trump’s executive order banning immigration from seven   countries. He declined politely, other than to say that it was “ a very tough situation” and “hard for me to talk about right now. ” I asked two of the more thoughtful members of the Patriots, the defensive linemen Alan Branch and Chris Long, if they had anything to say about these developments. They absolutely did, they said, and would speak out at some point later, but they did not want to create any “distractions” during Super Bowl week. The Patriots tight end Martellus Bennett did say that if the Patriots won on Sunday and were invited to the White House, he would probably not go, because “I don’t support the guy that’s in the [White] House. ” And really, was that so distracting? One enduring reason the Patriots are constantly being asked about their Trump connections is that the new president is hardly shy about reminding people of them. He has been dropping Brady’s name  —   and Kraft’s, and Belichick’s  —   at every opportunity over the last several months. This first became evident to me in the fall of 2015 as Trump was enjoying his unlikely rise to   status in the Republican primaries and I had several visits with him for a profile I was writing for the magazine. A few months earlier, I had written a story about Brady, who had just won his fourth Super Bowl and was then embroiled in the Deflategate fiasco, in which the league said it was “more probable than not” that Brady was “at least generally aware” that a minuscule amount of air pressure might have been removed from the footballs he used in the first half of the Patriots’   blowout of the Indianapolis Colts in the A. F. C. championship game. When Trump learned that I had recently spent time with Brady and around the Patriots, he became even more animated on the subject  —   and insistent that I enlist the star quarterback to say nice things about him for my story. “He’s a good friend of mine,” Trump said about Brady for the first of many times. “A really good friend of mine. ” Trump declared himself “disgusted” by the N. F. L. ’s treatment of Brady over Deflategate. “It’s so ridiculous what they’re doing to him. ” He mentioned he had just spoken to Brady. “He said: ‘Mr. Trump’  —   he calls me Mr. Trump, which he shouldn’t, because we play golf all the time. Anyway, he says: ‘Mr. Trump  —   Donald,’ he doesn’t even know what the [expletive] to call me. It’s the craziest thing. He’s a friend of mine. ” Also, Kraft  —   great friend, great friend. George Steinbrenner  —   “big time winner”  —   was Trump’s best friend, he said, and now Kraft is right up there, too, as one of his favorite guys. Kraft had visited him a few days earlier, and Trump said he chastised the Patriots owner for not fighting harder against the league’s suspension of Brady, in addition to other sanctions levied by the N. F. L. against the Patriots (including the loss of a   draft pick and a record fine). “You know, Bob Kraft is also one of my best friends,” Trump told me. “I said, ‘Bob, you should have never made the deal. ’” “Bob said, ‘I had a wink from the commissioner,’” Trump added, meaning that Kraft seemed to think that by standing down and not fighting the N. F. L. the league would reduce Brady’s penalty on appeal. Kraft was under pressure, Trump explained. “He choked, just like Romney choked. He said: ‘You know what? They winked at me.’ I said, ‘Bob when you make a deal, you should have gotten it all wrapped up.’ Who ever heard of making a deal like that? Now you got this mess. ” Kraft should never have trusted Goodell, he said. “The commissioner is a weak guy,” Trump said. “When he made the Ray Rice deal, everybody said: You’re stupid. You’re weak. And it was such a weak deal. So now he’s going overboard with their star, Brady. ” He added: “The commissioner is a dope. He’s a stupid guy. ” By far the best deal Kraft ever made was hiring Belichick, Trump said. Who, by the way, is also “a great, great friend” of Trump’s, even though everyone just assumes he’s “a really rough guy. ” “So I go to the Patriots game last year,” Trump said. “I’m on the sidelines with Kraft. He’s got Les Moonves right here. He’s got a lot of different people. And Belichick comes over in his Patriots sweatshirt and the hoodie and the whole thing. He hugs me, and he kisses me, and he said: ‘I love you. You’re the greatest. ’” Trump sat at his cluttered desk and seemed almost dreamy at the memory, as if the reception from Belichick genuinely moved him. “He just feels warmly toward me, Belichick does,” Trump said. “Isn’t that the craziest thing?” After the Deflategate ruling was handed down by the commissioner that spring, Trump said he tried to persuade Brady to sue the league personally. “I said, ‘Tom.’  —   I gave him a lawyer.  —   I said: ‘Here’s what you do. Sue the N. F. L. for $500 million tomorrow. Sue ’em up in Boston, for everything. They’ll come to the table.’ He said, ‘Aw, man.’ He really was torn. He’s not Trump. He said, ‘I just want to win another Super Bowl. ’” Trump told Brady that he understood. A few weeks later, the future president was showing me around Trump National Golf Club in Rancho Palos Verdes, Calif. We were accompanied by Damon Winter, a Times photographer who had, a few months earlier, photographed Brady for the profile that was published in February. At one point, as Trump showed me around his   golf Xanadu on the Pacific, he looked over at Winter. “Who’s got a better body, me or Tom Brady?” he asked. (No answer from Winter that I recall.) In the course of my time with Trump, he kept urging me to call Brady and ask him about his great friendship with Trump. Brady would say great things, no doubt. “Ask him, ‘How is Trump as a golfer? ’” Trump urged. Brady had been particularly hunkered down during the Deflategate ordeal. N. F. L. politics can be brutal like the   kind. Plus, the   in the press over his friendship with Trump was not making Brady any more eager to engage beyond his usual helpings of football platitudes. Finally, after Trump kept insisting, I reached out to Brady, fully expecting a polite   from the quarterback, and who could blame him? “I really have no interest in political talk right now,” Brady wrote. “I have learned way too much about politics the last seven months. ”",0
264,John McCain Withdraws Support for Donald Trump After Disclosure of Recording - The New York Times,Alan Rappeport,"Senator John McCain, the 2008 Republican presidential nominee, withdrew his support on Saturday for Donald J. Trump as the Republican Party descended into chaos. On Friday, a recording was released showing Mr. Trump speaking about women in lewd and degrading terms. Though he faced calls from many in his party to step aside, Mr. Trump vowed in an interview that he would “never drop out of this race in a million years. ” He later took a stronger stance on Twitter. Ms. Trump said in a statement on Saturday that although his words about women were “unacceptable and offensive” to her, she hoped that “people will accept his apology, as I have, and focus on the important issues facing our nation and the world. ” Mr. Trump showed up just before 5 p. m. in the lobby of Trump Tower in Manhattan, accompanied by his campaign manager, Kellyanne Conway, and his eldest child, Donald Trump Jr. Security officials stopped reporters and attempted to bar them from getting near Mr. Trump as he went outside and immersed himself in a crowd of supporters, who had gathered hours earlier for a rally. “Hundred percent,” Mr. Trump told reporters who yelled questions about whether he would stay in the race. He ignored other questions about his response to the defections by Republicans. Separately, one of Mr. Trump’s advisers, Rudolph W. Giuliani, a former mayor of New York City, was seen on CNN getting into a car outside Trump Tower, which he had earlier entered for planned debate preparation sessions. “There is nothing that will cause his dropping out,” Mr. Giuliani said. “That is wishful thinking of the Clinton campaign and those who have opposed him for a long time. ” Robert and Rebekah Mercer, the Republican megadonors who previously supported Senator Ted Cruz, suggested Mr. Trump’s remarks were irrelevant to the race. “If Mr. Trump had told Billy Bush, whoever that is, earlier this year that he was for open borders, open trade and executive actions in pursuit of gun control, we would certainly be rethinking our support for him,” they said in a statement. The Mercers also compared Mr. Trump’s actions to Bill Clinton’s treatment of women. The tactic is a favorite of Mr. Trump’s supporters, including Sean Hannity, the Fox News host, who devoted most of his show on Friday evening to allegations of abuse by Mr. Clinton. • Condoleezza Rice, the secretary of state under President George W. Bush, who has generally has not discussed politics since becoming a private citizen, called for Mr. Trump to leave the race. She said she hoped to support someone who has the dignity and stature to be president. “Enough!” Ms. Rice said in a Facebook post. “Donald Trump should not be President. He should withdraw. ” • Mr. McCain, who has criticized Mr. Trump repeatedly, officially withdrew his backing. “I have wanted to support the candidate our party nominated,” he said in a statement. He added: “But Donald Trump’s behavior this week, concluding with the disclosure of his demeaning comments about women and his boasts about sexual assaults, make it impossible to continue to offer even conditional support for his candidacy. ” • House Speaker Paul D. Ryan said he was “sickened” by Mr. Trump’s behavior and disinvited him from a Saturday event in Wisconsin. There, he referred obliquely to the episode. “There is an elephant in the room. That is not what we are here to talk about today. ” (Here’s how Mr. Ryan and Senator Mitch McConnell, the majority leader, have condemned Mr. Trump in past statements.) • Former primary opponents such as Carly Fiorina and Gov. John Kasich of Ohio said Mr. Trump should stand down. Mr. Kasich declared that the warning signs were right and that he would never vote for Mr. Trump. • Mr. Trump’s most strident defender, his running mate, Gov. Mike Pence of Indiana, called the remarks from the 2005 video indefensible. • We are also tallying the number of Republican leaders who say they won’t vote for Mr. Trump. Experts say that swapping out a presidential nominee at this stage of the game would be virtually impossible unless Mr. Trump dies, becomes incapacitated or decides to quit. Trying to change the Republican National Committee’s rules with so little time until Election Day would be a logistical nightmare, and those rules do not give the party the power to change the nominee because people are unhappy. If Mr. Trump did decide to drop out, the logistics would also be challenging because ballots have been printed and voting has already started in many places. We break it down in our Q. and A. Still, as unlikely as that scenario appears to be, that remains the best hope for finding a new nominee. The showdown between Mr. Trump and Mrs. Clinton on Sunday night takes on even greater importance after Mr. Trump’s latest controversy. Unless he speaks beforehand, it will be his first chance to publicly take questions about his behavior on the recording. The audience could approach 100 million. Many Republicans who have yet to denounce Mr. Trump have suggested that the debate will be a    moment for him. Take a look.",0
